title,published_at,content,url,source_name,domain,sub_domain,crawled_at
Fidra buys 1 GW UK BESS project from Innova ahead of cap-and-floor decision - Energy Storage,2026-06-03,"Fidra Energy has acquired the 1 GW Enderby battery storage project from Innova, expanding its BESS development pipeline to over 4.1 GW in the process.
Edinburgh-based Fidra Energy has purchased the in-development Enderby BESS project ahead of a final investment decision, expected in 2027. The site secured planning consent in May 2025 and is one of the large-scale BESS projects in the running for a cap-and-floor offtake agreement via a new government support scheme for long-duration energy storage (LDES).
Fidra Energy should find out if Enderby BESS has been successful in the United Kingdom’s first cap-and-floor LDES application round in summer 2026, and the developer expects to make a final investment decision on the project in 2027. Securing an LDES cap-and-floor agreement would provide Enderby BESS with government-backed, bankable long-term revenue that investors typically look for in under-development projects.
Fidra Energy has experience securing institutional backing for major projects. The developer has been backed by EIG and the UK state-owned investment vehicle the National Wealth Fund. If Fidra is able to move ahead with Enderby BESS, it is expected to deliver up to 1,025 MW of power capacity making it one of the largest battery storage projects in the United Kingdom.
Morris Van Looy, chief growth and strategy officer of Fidra Energy said the acquisition was a major milestone for the company and shows its ambition to deliver large-sale energy storage at a pace that support’s the UK government’s 2030 targets.
The UK government published its Clean Power 2030 Action Plan in December 2024, setting ambitious decarbonization targets for the electricity grid. Targets for 2030 include 23 GW to 27 GW of battery capacity, 4 GW to 8 GW of long-duration energy storage, and development of other flexibility technologies. Modo Energy recorded around 6.8 GW of BESS in Great Britain at the end of 2025.
Enderby BESS is the third utility-scale, transmission-connected battery project sold by Innova in the last 12 months. Daniel Mushin, chief finance and investment officer at Innova said the three sales combined account for over 2.4 GW of new capacity – a major contribution to 2030 targets.
The acquisition adds another gigawatt-scale project to Fidra Energy’s existing pipeline of major BESS assets. Construction is now underway at the 1.4 GW/3.1 GWh Thorpe Marsh site following a successful capital raise in 2025. Fidra Energy also expects to make a final investment decision in June 2026 on its 500 MW/1.1 GWh BESS project in West Burton, Nottinghamshire. Both sites are expected to be fully operational by 2028, according to the developer.",https://www.ess-news.com/2026/06/03/fidra-buys-1-gw-uk-bess-project-from-innova-ahead-of-cap-and-floor-decision/,ESS News,储能,储能项目/应用,2026-06-04T00:09:17+00:00
Consortium breaks ground on 230 MWh battery project in Japan - Energy Storage,2026-06-03,"A consortium of Itochu Corp., Mitsubishi Estate, and Tokyo Century has begun construction of a 67 MW/230.1 MWh battery energy storage system in Chikuzen, Fukuoka prefecture, targeting commercial operation in fiscal 2027 and participation across Japan’s capacity, wholesale, and balancing markets.
The facility will deploy 102 units of PowerX’s Mega Power 2500 containerized system, each housed in a 10-foot ISO container using lithium iron phosphate chemistry. PowerX lists nominal capacity at 2,507 kWh and rated capacity at 2,256 kWh per unit – 102 units at rated capacity reconciles to the project’s 230.1 MWh total. The product is supplied under PowerX’s partnership with Itochu, branded as the PowerX × Bluestorage package. PowerX manufactures the Mega Power 2500 at its facility in Tamano, Japan.
The project was selected for Japan’s Ministry of Economy, Trade and Industry (METI) fiscal 2025 subsidy program for utility-scale storage. The three sponsors will split financing and operational responsibilities, though the exact capital structure has not been disclosed. An AI-based optimization system will manage dispatch across the three market participation categories.
Kyushu has experienced acute solar curtailment and interconnection constraints as the region’s rapid solar buildout has outpaced the grid’s ability to absorb variable generation, making it one of Japan’s most active markets for storage deployment. The sponsors said the facility is designed to participate in regional balancing as well as national capacity and wholesale markets, combining regulated subsidy support with multi-market revenue exposure.
Japan’s grid-scale storage pipeline has expanded sharply, with companies seeking connections for 113 GW of storage capacity, according to Reuters reporting in 2025. METI’s auction framework and subsidy programs are shaping which projects advance to construction. The
120 MWh Eku Energy project in Miyazaki prefecture
, which broke ground in 2024 with a Tokyo Gas offtake agreement, illustrates the range of commercial structures emerging across the country as developers combine contracted and merchant revenue to underpin project finance.",https://www.ess-news.com/2026/06/03/consortium-breaks-ground-on-230-mwh-battery-project-in-japan/,ESS News,储能,储能项目/应用,2026-06-04T00:09:19+00:00
Batteries emerge as tool to expand collective self-consumption in France - Energy Storage,2026-06-03,"As support mechanisms for solar come under pressure and power price volatility increases, battery storage is becoming an increasingly important component of
collective self-consumption solar projects
Battery storage is playing a growing role in France’s collective self-consumption market as project developers seek to maximize local consumption of solar generation and reduce exposure to increasingly volatile electricity markets.
The shift comes as historical support mechanisms for solar face uncertainty and periods of negative electricity prices become more frequent, reducing the value of exporting excess generation to the grid. Batteries allow operators to store surplus electricity and use it later within a collective self-consumption scheme, increasing the share of locally consumed energy.
French regulations already provide a framework for integrating storage into collective self-consumption projects. Article D315-5 of the French Energy Code treats energy sent to a storage system as consumption within the operation, while electricity discharged from storage is considered generation. The approach allows batteries to participate fully in energy allocation mechanisms while maintaining consistency in accounting for energy flows.
The value of batteries extends beyond increasing self-consumption rates. By separating the timing of generation from the timing of energy use or sale, storage systems can support energy arbitrage strategies. Electricity can be stored when its market value is low and discharged when prices are more favorable, helping project operators smooth revenues and reduce exposure to unfavorable market conditions.
According to French grid operator Enedis, storage systems can be connected to generation assets, consumption assets, installations combining both generation and consumption, or directly to the public distribution network, provided grid connection requirements are met.
However, Enedis notes that a storage system alone cannot constitute a collective self-consumption operation. Such projects must include a participating generation asset and cannot be structured solely around battery storage.
The growing use of batteries is also creating opportunities for more sophisticated energy allocation models. While many collective self-consumption projects rely on dynamic allocation keys, storage systems can support time-based and other advanced allocation strategies that prioritize specific uses or optimize energy distribution throughout the day and year.
The article notes that proposed regulatory changes affecting allocation keys could limit the development of such approaches.
French collective self-consumption specialist Jane is developing projects that
combine battery storage with advanced allocation mechanisms
, including time-based allocation models. Co-founder Nathan Bouldoires said the company aims to help market participants take advantage of emerging opportunities in collective self-consumption by integrating technologies and optimization tools that could improve project performance.
Enogrid is also examining the role of battery storage in collective self-consumption projects and has scheduled an online training session on the topic for industry professionals on June 25.",https://www.ess-news.com/2026/06/03/batteries-emerge-as-tool-to-expand-collective-self-consumption-in-france/,ESS News,储能,储能项目/应用,2026-06-04T00:09:21+00:00
Kyon Energy to build 146.5 MW battery storage project in Germany - Energy Storage,2026-06-03,"Kyon Energy has announced plans for a 146.5 MW/296 MWh battery energy storage system at the Mehringen substation in Lower Saxony, Germany.
Construction is scheduled to begin in July or August of this year, with commissioning planned for October 2027. Kyon Energy said the timeline is largely determined by delivery times for high-voltage transformers and the modifications required at the substation to enable grid connection.
The Mehringen substation is considered an important grid node in the region. According to Avacon’s energy monitor, the storage system would be capable of supplying the entire Nienburg district, including industrial consumers, for around 10 hours.
Kyon Energy said the project will comprise 65 containerized lithium iron phosphate (LFP) battery units. Forty-six medium-voltage stations will convert direct current from the batteries into alternating current and increase the voltage level to 30 kV. Two high-voltage transformers are planned for the grid connection.
The project site covers around 3.3 hectares. The company said part of the area will be used for mitigation measures, including visual screening berms, hedges, and grassland.
The announcement follows the start of construction in May on three large-scale battery storage projects in North Rhine-Westphalia, Saxony-Anhalt, and Schleswig-Holstein, which will have a combined power capacity of 273 MW and storage capacity of 552 MWh.",https://www.ess-news.com/2026/06/03/kyon-energy-to-build-146-5-mw-battery-storage-project-in-germany/,ESS News,储能,储能项目/应用,2026-06-04T00:09:23+00:00
Powergrid seeks EPC partners for 400 MW/1.6 GWh of battery storage in India - Energy Storage,2026-06-03,"Power Grid Corp. of India Ltd. (Powergrid) has started accepting bids from engineering, procurement and construction (EPC) contractors for 400 MW/1.6 GWh of standalone battery energy storage system (BESS) capacity in West Bengal, India, as it prepares to participate in the state’s ongoing 750 MW/3,000 MWh battery storage procurement.
The 400 MW portfolio forms part of a 750 MW/3,000 MWh standalone battery storage program being procured by West Bengal State Electricity Distribution Co. Ltd. (WBSEDCL) through a competitive tender process overseen by the state’s Department of Power.
If Powergrid is selected and awarded capacity under the tender, the company or a nominated entity will develop the projects as the battery storage developer on a build-own-operate basis.
The utility has invited bids for three storage packages totaling 400 MW/1,600 MWh: a 200 MW/800 MWh project at DPL, a 100 MW/400 MWh project at Kharagpur, and a 100 MW/400 MWh project at Hooghly.
The scope of work includes the design, supply, installation, testing, and commissioning of the battery storage systems. Selected contractors will also provide operation and maintenance services for 15 years following commissioning.
Powergrid has specified a project delivery period of 15 months from contract award to commissioning.
Selected bidders will serve as pre-qualified EPC partners for Powergrid’s participation in the state tender. The company said it will sign a memorandum of understanding with the selected contractors before submitting its bid.",https://www.ess-news.com/2026/06/03/powergrid-seeks-epc-partners-for-400-mw-1-6-gwh-of-battery-storage-in-india/,ESS News,储能,储能项目/应用,2026-06-04T00:09:24+00:00
TagEnergy commissions France's largest battery storage project - Energy Storage,2026-06-03,"TagEnergy has commissioned its first operational asset in France, a 240 MW/480 MWh battery energy storage system (BESS) in Cernay-lès-Reims.
As battery storage deployment gathers pace in France, the developer has launched commercial operations at the project, which is now the country’s largest operating BESS. Located in the Grand Est region, the facility has more than twice the capacity of France’s second-largest operational battery storage system.
The asset is jointly owned by TagEnergy and Banque des Territoires. It was developed using Tesla Megapack technology in partnership with French transmission system operator RTE, regional utility SICAE de la Somme et du Cambrésis, and local authorities including the municipality of Cernay-lès-Reims and the Greater Reims urban community.
Franck Woitiez, chief executive officer of TagEnergy France, said the project marks the company’s first operational asset in the French market and reflects its long-term commitment to developing the energy storage capacity needed to support the country’s energy transition.
France’s battery storage sector has expanded rapidly in recent years, with installed capacity growing from less than 50 MW five years ago to about 1.5 GW at the beginning of 2026.",https://www.ess-news.com/2026/06/03/tagenergy-commissions-frances-largest-battery-storage-project/,ESS News,储能,储能项目/应用,2026-06-04T00:09:26+00:00
Enspired aims to unlock market flexibility for Romanian BESS - Energy Storage,2026-06-03,"Enspired has signed a strategic partnership with Romanian integrated energy services provider Alive Capital to offer a dedicated optimization software service for co-located and standalone battery energy storage assets operating in the Romanian market.
The Austrian BESS optimizer will bring its AI-powered trading and optimization technology tools to the platform, while Alive Capital offers its local expertise in the Romanian energy market as an aggregator, forecaster and portfolio optimizer.
Their joint offering aims to make it easier for BESS asset owners in Romania to participate across multiple energy markets, such as ancillary services and wholesale, and increase revenue generated by their assets through automated trading and advanced cross-market optimization strategies.
Enspired has already been contracted to optimize one of Southeast Europe’s largest standalone batteries, the 202 MW/404 MWh Arges project, as part of the deal. The Arges project is being developed by Göteborg-based Rapono and is targeting commercial operation in Q2, 2027 depending on its ability to meet financing and construction milestones. Swiss company Gunvor Group will market and commercially manage 100% of the project’s capacity via a cap and floor toll structure. This project deal was initially announced in May.
Flexibility services
Alive and Enspired are receiving a lot of interest in their platform proposal from local asset owners. Romania’s renewable capacity is growing fast, and as of May 2026, connected BESS capacity on the national energy system reached 600 MW of installed power with an associated storage capacity of 1.2 GWh. Grid connection agreements already signed indicate a pipeline of around 9 GW of additional BESS capacity. All of this means asset owners are anxious to capture new revenue streams, and the new platform aims to provide them with a tailor-made route-to-market.
For Enspired, the deal provides the company with a stepping stone into one of Europe’s most dynamic markets, said Jürgen Mayerhofer, CEO and co-founder of Enspired.
Giacomo Billi, CEO and co-founder of Alive Capital, said he hoped the partnership would showcase Romania “as a reference market for intelligent storage management.”
“By adding our technology and years of valuable hands-on experience in managing live assets across Europe, this partnership provides the operational credibility to translate advanced technology into real-world performance for asset owners in the region,” Mayerhofer added.
According to figures from its website, Enspired has more than 2.5 GW of BESS under management and 1 GWh of BESS optimized live. As well as Austria and Romania, it is active in
, Spain and Poland.
Its Spain and Poland expansions were announced last July with
partnership models with local firms
similar to the approach it is taking with Romania.
Last October, it raised more than €40 million in an extended Series B funding round to expand its battery optimization services
beyond Europe
, with Japan a key focus.",https://www.ess-news.com/2026/06/03/enspired-aims-to-unlock-market-flexibility-for-romanian-bess/,ESS News,储能,储能项目/应用,2026-06-04T00:09:28+00:00
"Protium, ITM Power partner on UK green hydrogen projects",2026-06-03,Battolyser Systems and VDL Hydrogen Systems to merge,https://hydrogentechworld.com/protium-itm-power-partner-on-uk-green-hydrogen-projects,Hydrogen Tech World,氢能,技术/产业新闻,2026-06-04T00:09:40+00:00
陈江照NC：低温化学沉淀法合成高质量氧化镍纳米颗粒实现高性能钙钛矿光伏_手机网易网,2026-06-03,"高效反式钙钛矿太阳能电池（PSCs）常常采用由NiOx和自组装分子（SAM）空穴传输材料组成的双
传输层（HTL）。然而，目前使用的NiOx纳米颗粒材料存在杂质含量高、空穴传输效率低、SAM分子覆盖率不足、界面结合力弱、
埋底界面不稳定以及能级不匹配等问题。
沉淀策略，合成出高质量的NiOx
颗粒，并用作空穴传输层。与常温制备方法相比，低温制备的NiOx薄膜具有更高的Ni3+/Ni2+比例、更低的杂质含量、更高的电导率和空穴迁移率。此外，该策略还提升了SAM分子覆盖率，缓解了能级失配，加快了空穴提取速率，并增强了钙钛矿埋底界面的稳定性。优化后的器件实现了27.1%的认证光电转换效率，14 cm2的微型组件效率达到23.18%。器件连续运行2100小时后仍保持91.5%的初始效率，在湿热老化2000小时后仍保持91.4%的初始效率。该研究工作为制备高质量NiOx空穴传输层提供技术支撑，为反式钙钛矿光伏技术的大规模商业化应用奠定坚实的基础。
Fig. 1 | Characterizations of the NiOx NPs and films.
, High-resolution TEM images of RT-NiOx and LT-NiOx NPs (scale bar 10 nm). The red boxes highlight the regions of NiOx NPs agglomeration.
, Particle size distribution graphs of RT-NiOxand LT-NiOx NPs.
, Zeta potential (
) and dynamic light scattering (
) of RT-NiOx and LT-NiOx NPs dispersion solutions following 960 h of static aging.
, SEM images of RT-NiOx (
) and LT-NiOx (
) films after 960 h of ambient air exposure (scale bar 200 nm).
, XPS spectra of Ni 2p core levels for RT-NiOx (
) and LT-NiOx(
, XPS spectra of N 1s core levels for RT-NiOx(
) and LT-NiOx (
, Hole mobility of RT-NiOx and LT-NiOx films.N 1s core levels for RT-NiOx (
) and LT-NiOx (
Schematical illustration of synthesizing NiOxNPs through RTCP and LTCP method. a
, Synthesizing NiOx NPs with large amount of NO3- impurity and lower content of Ni3+ through RTCP.
, Synthesizing NiOx NPs with small amount of NO3- impurity and higher content of Ni3+through LTCP.
Fig. 3|Characterizations of quality of buried interfaces fabricated on RT-NiOxand LT-NiOx. a
, C-AFM images of RT-NiOx/SAM (
) and LT-NiOx/SAM (
) films (scale bar 2 μm).
, Current of the diagonal line scan in
, Correlation between peak current and scan rate for the oxidation peaks of RT-NiOx/SAM (
) and LT-NiOx/SAM (
) as determined by cyclic voltammetry.
, Top-view SEM images of the bottom surface of the perovskite films deposited on RT-NiOx/SAM (
) and LT-NiOx/SAM (
) (scale bar 1 μm).
, Cross-sectional SEM images of the perovskite films deposited on RT-NiOx/SAM (
) and LT-NiOx/SAM (
) (scale bar 500 nm).
, AFM images of bottom surface of the perovskite films deposited on RT-NiOx/SAM (scale bar 200 nm and thecolor-coded scale bar represents roughness) (
) and LT-NiOx/SAM (
). The difference between GBG side angles of the perovskite films deposited on RT-NiOx/SAM and LT-NiOx/SAM is schematically shown.
, Relationship between 2θ andsin2j for the perovskite films deposited on RT-NiOx/SAM and LT-NiOx/SAM.
, Defect density of the perovskite films deposited on RT-NiOx/SAM and LT-NiOx/SAM from the hole-only devices.
, PLQY of ITO/RT-NiOx or LT-NiOx/SAM/perovskite and ITO/RT-NiOx or LT-NiOx/SAM/perovskite/PC61BM.
, QFLS of ITO/RT-NiOx or LT-NiOx/SAM/perovskite and ITO/RT-NiOx or LT-NiOx/SAM/perovskite/PC61BM.
Fig. 4 | Interfacial carrier dynamics and buried interface stability. a
, TRS of the perovskite films on ITO/RT-NiOₓ/SAM (
) and ITO/LT-NiOₓ/SAM (
, TRPL curves of the perovskite films on ITO/RT-NiOₓ/SAM and ITO/LT-NiOₓ/SAM measured by ITO side.
, TPC decay curves of the PSCs based on RT-NiOxand LT-NiOx.
, Dark current characteristics of the PSCs with RT-NiOx and LT-NiOx.
,VOC dependent on the light intensity for the PSCs employing RT-NiOx and LT-NiOx.
, SEM images (scale bar 1 μm) of bottom surfaces for the perovskite films on ITO/RT-NiOₓ/SAM (
) and ITO/LT-NiOₓ/SAM (
)after 480 h of continuous one sun illumination at 85°C.
, Cross-sectional SEM images (scale bar 1 μm) for the perovskite films on ITO/RT-NiOₓ/SAM (
) and ITO/LT-NiOₓ/SAM (
) after 480 h of continuous one sun illumination at 85°C.
, PL mapping images (scale bar 1 μm and the color scale bar represents the PL intensity.) of bottom surfaces for the perovskite films on ITO/RT-NiOₓ/SAM (
) and ITO/LT-NiOₓ/SAM (
)after 480 h of continuous one sun illumination at 85°C.
Fig. 5 | Photovoltaic performance and stability of devices. a
, J-V curves of the champion 1.55 eV inverted PSCs based on RT-NiOxand LT-NiOx.
, Statistic diagram of reported inverted PSCs with certified PCEs exceeding 27%.
, J-V curves of the best-performing 1.68 eV inverted PSCs using RT-NiOx and LT-NiOx.
, J-V curves of the optimal 1.78 eV inverted PSCs with RT-NiOx and LT-NiOx.
, J-V curve of the 14 cm2 inverted PSC module fabricated using LT-NiOx.
,Statistical chart of reported 10-20 cm2 PSC modules with PCEs exceeding 22%.
, Stability of 1.55 eV inverted PSCs based on RT-NiOx and LT-NiOx at MPPT under one sun illumination.
, Stability for 1.55 eV inverted PSCs based on RT-NiOx and LT-NiOx under 85°C and 85% RH conditions.Error bars show the standard deviation of multiple independent devices.
Ziyuan Liu#, Dongmei He#, Zuolin Zhang#, Kun Zhang#, Ziyi Tang, Shaokuan Gong, Xilai He, Xinxing Liu, Xuxia Shai, Yue Yu, Jiajia Zhang, Xihan Chen, Xuanhua Li, Yang Wang, Cong Chen, Jianhong Yi & Jiangzhao Chen*. High-quality NiOxnanoparticles synthesized via low temperature chemical precipitation method for high-performance inverted perovskite photovoltaics. Nature Communication2026, 10.1038/s41467-026-73911-6.
https://www.nature.com/articles/s41467-026-73911-6
器件学术QQ群：641345719
钙钛矿产教融合交流@知光谷（微信群）：需添加编辑微信
为加强科研合作，我们为海内外科研人员专门开通了
，备注：姓名-单位-研究方向（无备注请恕不通过），由编辑审核后邀请入群。",https://www.163.com/dy/article/KUG97F690552LHQK.html,网易知光谷,光伏,光伏产业,2026-06-04T00:10:16+00:00
