title,published_at,content,url,source_name,domain,sub_domain,crawled_at
NASA’s Fermi Telescope Caught a Supernova Doing Something Never Seen Before,2026-06-03,"’s Fermi telescope may have finally uncovered the magnetic powerhouse behind the universe’s brightest supernovae.
An international team of astronomers analyzing observations from
NASA’s Fermi Gamma-ray Space Telescope
has found what appears to be the first convincing detection of gamma rays from a rare type of extraordinarily bright stellar explosion known as a superluminous supernova.
Their findings suggest the explosion was powered by a newly formed magnetar, an extremely magnetized
neutron star
created when a massive star collapsed. The discovery provides fresh insight into some of the most energetic explosions in the universe.
NASA’s Fermi mission is part of a fleet of observatories that monitor changes across the cosmos, helping scientists better understand how the universe evolves.
“For nearly 20 years, astronomers have
searched Fermi data
for gamma-ray signals from thousands of supernovae, and while a few intriguing hints have been reported, none were definitive until now,” study lead Fabio Acero at the French National Centre for Scientific Research (CNRS) and the University of Paris-Saclay.
The results were published in the journal
Astronomy & Astrophysics
Core-collapse supernovae occur when a massive star, many times larger than the Sun, exhausts the fuel needed to support itself. Without that energy source, the star’s core collapses under gravity and triggers a powerful explosion.
The collapse can leave behind either a neutron star roughly the size of a city or an even more compact
. Meanwhile, a powerful shock wave blasts the outer layers of the star into space, creating a rapidly expanding cloud of hot, ionized gas.
Over the past two decades, astronomers have identified nearly 400 unusually bright examples of these explosions. Known as superluminous supernovae, they can shine more than ten times brighter in visible light than typical supernovae.
In 2024, a study led by Li Shang of Anhui University in Hefei, China, suggested that Fermi’s Large Area Telescope may have detected gamma rays from one of these exceptional explosions years after it occurred.
That event, called SN 2017egm, erupted in the galaxy NGC 3191, about 440 million light-years from Earth in the constellation Ursa Major. Despite its great distance, it remains one of the nearest superluminous supernovae ever observed.
“We searched for gamma rays from the six nearest superluminous supernovae seen during the first 16 years of Fermi’s mission,” said Guillem Martí-Devesa, a researcher previously at the University of Trieste in Italy and now a fellow at the Institute of Space Sciences in Barcelona, Spain. “Only SN 2017egm shows evidence for gamma rays, confirming earlier hints that some supernovae can be as luminous in gamma rays as they are in visible light. This opens up a new window for studying these fascinating events.”
Scientists have long debated what supplies the enormous energy behind superluminous supernovae. One leading explanation involves the birth of a magnetar, a neutron star possessing the strongest magnetic fields known in nature.
These magnetic fields can be up to 1,000 times stronger than those of ordinary neutron stars, reaching roughly 10 trillion times the strength of a refrigerator magnet.
To investigate, researchers conducted a detailed analysis of both the optical and gamma-ray observations of SN 2017egm. They compared the data with several theoretical models designed to explain the explosion’s behavior.
One model, developed by co-authors Indrek Vurm of the University of Tartu in Estonia and Brian Metzger of
Columbia University
in New York City, simulated how particles and radiation from a newly born magnetar would interact with the expanding material ejected by the supernova.
Scientists expect newborn magnetars to rotate extremely rapidly, completing hundreds of spins every second. This rapid rotation generates a powerful flow of electrons and positrons, which are the antimatter counterparts of electrons.
These particles create a huge region known as a
magnetar wind nebula
, filled with highly energetic particles.
Within this environment, numerous interactions can create and absorb gamma rays. For example, an electron and a positron can annihilate each other and produce gamma-ray photons. Gamma rays can also collide and create new particle pairs.
As these interactions continue, gamma rays become trapped within the expanding supernova debris. Rather than escaping immediately, much of their energy is converted into lower-energy visible light. This process helps explain why superluminous supernovae shine so intensely.
“About three months after the collapse, as the supernova debris expands and cools, the gamma rays can begin to leak out,” Acero said. “This magnetar model best reproduces the supernova’s luminosity and the arrival time of its gamma rays during the first months, but we see room for improvement at later times, when the visible light fades quite irregularly.”
The researchers believe other processes likely contributed to the supernova’s behavior as it gradually dimmed.
Possible factors include material falling back onto the magnetar and interactions between the expanding blast wave and matter expelled by the star during the centuries before its final collapse.
The team also explored whether future facilities could detect similar events. Their analysis suggests the new ground-based Cerenkov Telescope Array Observatory could identify a supernova like SN 2017egm from as far away as about 500 million light-years with roughly 50 hours of observations.
Scientists expect that combining observations from facilities like the Cerenkov Telescope Array Observatory with data from NASA’s space-based telescopes will significantly improve understanding of these extraordinary explosions.
“The magnetar central engine mechanism discussed in this paper builds upon a lot of observational and theoretical advances in magnetars over the last 20 years,” said Judy Racusin, a deputy project scientist for the Fermi mission at NASA’s Goddard Space Flight Center in Greenbelt, Maryland. “Observing gamma rays from supernovae will give us a new way to explore their inner workings.”
Reference: “Gamma-ray signature of superluminous supernovae:
-LAT GeV detection of SN 2017egm and evidence of a central engine” by F. Acero, A. Acharyya, A. Adelfio, M. Ajello, E. Aviano, L. Baldini, J. Ballet, C. Bartolini, D. Bastieri, J. Becerra Gonzalez, R. Bellazzini, E. Bissaldi, R. Bonino, P. Bruel, S. Buson, R. A. Cameron, P. A. Caraveo, F. Casaburo, F. Casini, E. Cavazzuti, C. C. Cheung, N. Cibrario, G. Cozzolongo, P. Cristarella Orestano, F. Cuna, S. Cutini, F. D’Ammando, D. Depalo, S. W. Digel, N. Di Lalla, A. Dinesh, L. Di Venere, P. Fauverge, A. Fiori, A. Franckowiak, Y. Fukazawa, S. Funk, P. Fusco, F. Gargano, C. Gasbarra, D. Gasparrini, S. Germani, F. Giacchino, N. Giglietto, M. Giliberti, F. Giordano, M. Giroletti, I. A. Grenier, M.-H. Grondin, S. Guiriec, R. Gupta, E. Hays, J. W. Hewitt, A. Holzmann Airasca, D. Horan, X. Hou, T. Kayanoki, M. Kerr, M. Kuss, A. Laviron, M. Lemoine-Goumard, A. Liguori, J. Li, I. Liodakis, P. Loizzo, F. Longo, F. Loparco, S. López Pérez, L. Lorusso, M. N. Lovellette, P. Lubrano, S. Maldera, A. Manfreda, G. Martí-Devesa, R. Martinelli, M. N. Mazziotta, M. Michailidis, P. F. Michelson, N. Mirabal, T. Mizuno, P. Monti-Guarnieri, M. E. Monzani, A. Morselli, I. V. Moskalenko, M. Negro, N. Omodei, M. Orienti, E. Orlando, G. Panzarini, M. Persic, M. Pesce-Rollins, R. Pillera, T. A. Porter, G. Principe, S. Rainò, R. Rando, B. Rani, M. Razzano, A. Reimer, O. Reimer, M. Sánchez-Conde, P. M. Saz Parkinson, D. Serini, C. Sgrò, E. J. Siskind, G. Spandre, P. Spinelli, D. J. Suson, H. Tajima, D. J. Thompson, D. F. Torres, Z. Wadiasingh, K. Wood, G. Zaharijas, W. Zhang, E. Chatzopoulos, B. D. Metzger, P. J. Pessi and I. Vurm, 20 May 2026,
Astronomy & Astrophysics
DOI: 10.1051/0004-6361/202558547
Never miss a breakthrough:
Join the SciTechDaily newsletter.
Follow us on
Astrophysics
Fermi Gamma-ray Space Telescope
NASA Goddard Space Flight Center
Defying Expectations: NASA’s Fermi Sees No Gamma Rays From Nearby Supernova
Unidentified Cosmic Phenomena: Fermi’s Gamma-Ray Discovery Shocks Astronomers
Cosmic Cinema: NASA Unveils Stunning 14-Year Time-Lapse of the Gamma-Ray Sky
NASA’s Fermi Space Telescope Captures Cosmic Fireworks in Dynamic Gamma-Ray Sky
Strange Long-Lasting Pulse of High-Energy Radiation Swept Over Earth
NASA’s Fermi Space Telescope Hunts for Gravitational Waves From Monster Black Holes
NASA’s Fermi Spots a Weird Pulse of High-Energy Radiation Racing Toward Earth
NASA’s Roman Mission: Using Exploding Stars to Solve the Biggest Cosmic Mysteries
NASA Spacecraft Unmask High-Energy Blast That Swept Through the Solar System – Magnetar Eruption in Nearby Galaxy",https://scitechdaily.com/nasas-fermi-telescope-caught-a-supernova-doing-something-never-seen-before/,scitechdaily,综合科技,无,2026-06-03T22:37:25+00:00
Scientists Discover a Bizarre Crocodile Cousin That Walked Like a Dinosaur,2026-06-03,"A newly discovered crocodile relative from the
had a beak, tiny arms, and walked on two legs, making it look more like an ostrich-like dinosaur than a crocodile.
During the Triassic Period, the ancestors of many modern animal groups were branching into an astonishing variety of shapes and lifestyles. Evolution was experimenting with body plans that often resemble familiar animals today, even though those ancient creatures belonged to very different lineages.
One striking new example is
Labrujasuchus expectatus
Described in the
Journal of Vertebrate Paleontology
, this newly identified reptile had a body shape that would seem more at home among ostrich-like dinosaurs than crocodile relatives. Yet despite its appearance, Labrujasuchus belonged to the archosaur lineage that eventually gave rise to modern crocodiles.
Unlike today’s crocodilians, which are four-legged predators with powerful jaws and plenty of teeth,
Labrujasuchus
moved on two legs, had tiny forelimbs, and possessed a toothless beak. In many ways, it looked about as different from a crocodile as possible.
As the researchers note, when it comes to the Triassic, surprises are the norm.
The Triassic was home to an extraordinary collection of reptiles that often seem almost alien by modern standards.
Among them were lagerpetids, close relatives of dinosaurs whose descendants would eventually evolve into flying pterosaurs. There was also the unusual tree-dwelling Drepanosaurus, which sported a large claw reminiscent of a tree sloth’s and an additional claw on its prehensile tail. Another resident of this strange world was Vancleavea, an armored aquatic reptile sometimes compared to a miniature tank.
Into this landscape stepped
Labrujasuchus expectatus
, the newest known member of Shuvosauridae. This small group consisted of crocodile relatives whose body plans closely resembled those of bipedal theropod dinosaurs, complete with reduced forelimbs.
“We see a lot of the successful strategies for modern animals and non-avian dinosaurs first arise in the Triassic, and shuvosaurs are a great example of that convergent evolution,” says Dr. Alan Turner, lead author on the paper. “Bipedalism is certainly a unique path for crocodile relatives to take, but it’s a path well-trod by dinosaurs and later birds. It obviously worked for these animals.”
Only five shuvosaur
have been identified so far, making the discovery particularly significant.
Researchers say
Labrujasuchus expectatus
helps bridge a gap between two previously known shuvosaur species from the same region. Based on those earlier finds, paleontologists suspected that intermediate species likely existed and were waiting to be discovered.
That expected but previously missing fossil inspired the species name expectatus.
The genus name
Labrujasuchus
also reflects local history. It combines a reference to “Ranchos de los Brujos,” an old Spanish name for Ghost Ranch that translates to Ranch of the Witches, with the Greek word Σοῦχος (suchus), meaning “crocodile.”
“Legend has it, the local rancheros gave the site the name ‘Ranchos de Los Brujos’ to keep folks away from the cattle-rustling operations of the Archuleta brothers,” says Dr. Nate Smith, co-author and Gretchen Augustyn Director & Curator of the NHMLAC Dinosaur Institute. “We wanted to give a nod to that colorful history, and honor the incredible role Ghost Ranch has played in expanding our view of the Triassic. We also wanted to highlight how the fossil record works—finding one shuvosaur from earlier in the Triassic and one from later meant that we paleontologists knew there were probably more from in-between waiting to be discovered and described.”
Although the Triassic can feel like a completely different world, many of the evolutionary experiments that occurred during that time foreshadowed body plans and lifestyles that later became successful in other groups of animals.
Studying these ancient ecosystems helps scientists better understand how life evolved and provides valuable context for the modern species that inhabit Earth today, many of which face growing environmental pressures.
Few places offer a clearer window into that distant past than Ghost Ranch in New Mexico. The site contains four major fossil quarries that have been excavated for decades and continues to yield some of the best-preserved Triassic fossils ever discovered.
“This summer is the 20th anniversary of Nate and his colleagues coming out to do excavations at Ghost Ranch, and we’re so proud to play a central role in making that incredible research possible,” says Joanne Lefrak, Director of Experience and Social Impact at the Ghost Ranch Education and Retreat Center, where teams of paleontologists and volunteers are hosted each summer. “Whether visitors are seeking its iconic landscape and spiritual healing or digging into ancient history, Ghost Ranch is a place like nowhere else on the planet. We’re looking forward to collaborating with Dr. Turner, Dr. Smith, and all their colleagues to continue sharing this extraordinary place for years to come.”
Ghost Ranch, famous for the dramatic landscapes featured in many of Georgia O’Keeffe’s paintings, remains the focus of a long-term excavation effort. The ongoing project, co-led by Dr. Smith through the NHMLAC Dinosaur Institute, continues to uncover Late Triassic animals from the Hayden Quarry, adding new pieces to the story of one of Earth’s most unusual eras.
Reference: “A new shuvosaurid (Archosauria, Poposauroidea) from the Late Triassic (Norian) Hayden Quarry of New Mexico, U.S.A.” by Alan H. Turner, Ciara E. Kernan, Adam Laing, Adam C. Pritchard, Michelle R. Stocker, Randall B. Irmis, Nathan D. Smith, Sarah Werning and Sterling J. Nesbitt, 26 May 2026,
Journal of Vertebrate Paleontology
DOI: 10.1080/02724634.2026.2618182
Never miss a breakthrough:
Join the SciTechDaily newsletter.
Follow us on
Paleontology
Ancient Skull Unearthed in Egypt Reveals a 30-Million-Year-Old Apex Predator
Extinct Creatures Fill Puzzling Gap in the Fossil Record
Strange 130-Year-Old Mystery of Vertebrate Evolution Solved Using Powerful X-Rays
Fearsome New Species of Stegosaur May Be the Oldest Ever Discovered in the World
Triassic Archosaur Fossils Excavated in the 1960s Add Missing Link to Crocodile Evolution
Kyhytysuka: 130-Million-Year-Old Hypercarnivore “Fish Lizard” Discovered
New Species of Tardigrade (Water Bear) Discovered in 16 Million-Year-Old Dominican Amber
Giant Waikato Penguin: School Kids in New Zealand Discover New Species
Fossils Reveal Headbutts May Have Been Used as a Dinosaur Courtship Behavior",https://scitechdaily.com/scientists-discover-a-bizarre-crocodile-cousin-that-walked-like-a-dinosaur/,scitechdaily,综合科技,无,2026-06-03T22:37:27+00:00
How Pigeons Find Their Way Home May Finally Be Solved,2026-06-03,"A study suggests pigeons navigate using iron-rich immune cells in their livers that can respond to Earth’s magnetic field. The findings may solve a decades-old mystery about bird navigation and reveal a surprising new sensory role for the immune system.
Pigeons are famous for their ability to travel long distances and still find their way home. For decades, scientists have tried to understand how they do it. A new study suggests that part of the answer may be found in an unexpected place: the liver.
Research published in
indicates that specialized immune cells in pigeons’ livers may help them detect Earth’s magnetic field, providing an internal compass that assists with navigation.
The cells, called macrophages, normally help break down aging red blood cells. As they perform this task, they accumulate iron. According to the researchers, that iron may give the cells unique quantum properties that allow them to respond to magnetic fields. When these cells were removed, the birds struggled to find their way home.
“We didn’t expect immune cells to act like sensors for magnetic fields at all. Our results reveal a previously unknown mechanism for magnetic perception in animals,” says Prof. Christian Kurts, Director at the Institute of Molecular Medicine and Experimental Immunology at the University Hospital Bonn, and one of the study’s co-senior authors.
“What looks like a ‘gut feeling’ in bird navigation may actually have a physical basis,” adds Prof. Martin Wikelski, Director at the Max Planck Institute of Animal Behavior and the other co-senior author of the study.
Tracks of homing pigeons that were trained to navigate over 20km back to their aviaries in Southern Germany. Some pigeons were treated with clodronate to deplete macrophages. Untreated pigeons (white) navigated successfully home on sunny and overcast days. Clodronate-treated pigeons also navigated successfully home on sunny days (orange), but could not navigate home on overcast days (blue). Credit: Max Planck Institute of Animal Behavior
Scientists have long known that migratory birds and homing pigeons use Earth’s magnetic field as one of several tools for navigation. Exactly how they detect that field, however, has remained unclear.
Previous ideas suggested that birds might perceive magnetic fields through light-sensitive molecules in their eyes or through tiny magnetic particles in their beaks. Despite years of investigation, convincing evidence for either explanation has been difficult to obtain.
The new study offers a different possibility. The international research team brought together immunologists from the University of Bonn and the University Hospital Bonn, physicists from the University of Duisburg-Essen, and ornithologists from the Max Planck Institute of Animal Behavior (MPI-AB).
To determine where magnetic sensing might occur, researchers examined several parts of the body that had been considered likely candidates, including the eyes, beak, and brain. They also investigated the liver and spleen.
Using techniques known as “vibrating sample magnetometry” and “magnetic cell separation,” the team measured magnetic properties in different tissues.
“We had some clues that the liver and spleen have magnetic properties, because they break down red blood cells and so store much iron in the body,” says first author Dr. Clivia Lisowski, from the University of Bonn and the University Hospital Bonn, who led the immunological work.
The liver stood out from all other tissues tested, showing the highest concentration of iron.
“Iron is crystallized in oxide nanoparticles making the cells superparamagnetic and reactive to magnetic fields. We found by far the strongest magnetic response in liver tissue,” adds Prof. Ulf Wiedwald, from the University of Duisburg-Essen.
Further investigation identified liver macrophages as the source of this magnetic response.
Miriam Widmann, a staff member at the Max Planck Institute of Animal Behavior, releases a homing pigeon as part of an experiment investigating navigation under overcast conditions. Credit: Christian Ziegler/ Max Planck Institute of Animal Behavior
To find out whether these cells actually influence navigation, researchers carried out homing experiments with pigeons trained to return to their aviary at the MPI-AB in Konstanz, Germany, from distances of more than twenty kilometers away.
When the liver macrophages were removed, the birds lost their sense of direction on overcast days, when the sun was not visible. Under sunny conditions, however, they were still able to return home successfully, likely by relying on solar cues instead of magnetic ones.
The results suggest that pigeons use multiple navigation systems and that magnetic sensing becomes particularly important when visual guidance from the sun is unavailable.
After demonstrating that the cells affected navigation, the researchers investigated how information from the liver might be transmitted to the brain.
Using electron microscopy, they found that the iron-rich macrophages are located close to nerve fibers. This arrangement could provide a pathway through which magnetic information is relayed to the nervous system.
Lisowski says: “These findings provide the first concrete evidence of how the Earth’s magnetic field can be perceived within the body and passed on to the brain to guide movement.”
The researchers say the discovery brings together several known biological processes, including iron metabolism and communication between the immune and nervous systems, into a possible explanation for how animals navigate using Earth’s magnetic field.
“Animal navigation is one of the most fascinating phenomena in nature,” says Wikelski. “If immune cells are part of how birds sense direction, it would fundamentally change how we understand navigation.”
Many questions remain, especially regarding how the brain processes signals originating from these liver cells.
The findings could also extend beyond pigeons. Animals such as sharks are able to navigate without relying on light, raising the possibility that similar mechanisms may exist in other
Researchers say the work opens the door to exploring whether animals, and perhaps even humans, respond to magnetic fields in ways that have not yet been fully understood.
Reference: “Homing pigeon navigation relies on superparamagnetic macrophages under overcast conditions” by Clivia Lisowski, Michael Quetting, Daniela Klaus, Lisa Lazarevski, Lea Seep, Maximilian Germer, Jian Li, Inge Müller, Daniel Zuniga, Wolfgang Fiedler, Dina K. N. Dechmann, Kasper Thorup, Jan Hasenauer, Lars Fester, Stefanie Kuerten, Michael Farle, Ulf Wiedwald, Martin Wikelski and Christian Kurts, 28 May 2026,
DOI: 10.1126/science.ady2486
Never miss a breakthrough:
Join the SciTechDaily newsletter.
Follow us on
Animal Behavior
Max Planck Institute
Ravens Don’t Follow Wolves, They Predict Them
Cryptogamic Covers Take Up Huge Amounts of Atmospheric Carbon Dioxide
Likelihood of Nuclear Accident 200 Times Greater than Previously Thought
Scientists Reveal the Structure of Bacterial Injection Needles at Atomic Resolution
Amorfrutins in Liquorice Root Have Important Anti-Diabetic Effects
Researchers Clarify Recycling Mechanism for Hydroxyl Radicals
Researchers Use Statistical Method to Challenge Criminological Theories
Large Globular Star Clusters Survive Collisions, Smaller Clusters Do Not
Physicists Measure the Propagation Velocity of Quantum Signals",https://scitechdaily.com/how-pigeons-find-their-way-home-may-finally-be-solved/,scitechdaily,综合科技,无,2026-06-03T22:37:28+00:00
