title,published_at,content,url,source_name,domain,sub_domain,crawled_at
This New DNA Test Solves Rare Disease Mysteries That Standard Genetics Misses,2026-06-19,"A new long-read
test improves rare disease diagnosis, replaces multiple existing tests, and could become the preferred global standard for genetic diagnostics.
A new DNA test is providing a far more detailed view of the genome than current standard diagnostic methods, helping doctors identify rare genetic disorders more often. The test can replace up to 15 existing diagnostic procedures, making the process faster and more efficient. In the
New England Journal of Medicine
, researchers from Radboud University Medical Center recommend adopting this approach worldwide as the first-line test for rare genetic diseases.
A disease is classified as rare when it affects fewer than one in 2,000 people. Even so, more than 7,000 rare diseases have been identified, affecting as many as 400 million people globally. About 80% of these conditions are caused by genetic changes. For many patients, obtaining a diagnosis can take years. A confirmed diagnosis can provide answers about a condition, help predict future health outcomes, connect patients with others facing similar challenges, and inform family planning decisions.
Researchers at Radboudumc and Maastricht UMC+ are collaborating to improve the diagnosis of genetic disorders. In a study involving 1,000 patients, they compared standard diagnostic approaches, which often require multiple tests, with a new DNA analysis method.
“We showed that the new test yields three percent more diagnoses. It can also replace fifteen other tests. We recommend using this test worldwide as the first choice,” said Professor of Translational Genomics Lisenka Vissers.
The technology relies on long-read genome sequencing. To identify genetic abnormalities, doctors analyze a person’s entire DNA sequence. Current methods typically read DNA in fragments of about 300 building blocks before assembling them into a complete sequence.
The new approach can read stretches of up to 20,000 building blocks at a time. Like completing a jigsaw puzzle with larger pieces, this makes it much easier to assemble the genome accurately and creates a more complete picture of a person’s DNA.
The test also captures chemical modifications attached to DNA, in addition to reading its genetic code. These modifications can turn genes on or off and may contribute to rare diseases.
“Therefore, it’s important that we measure those as well,” explained Professor of Genome Bioinformatics Christian Gilissen. “With current diagnostics, this requires additional specialized tests, but with long reads, we capture these modifications as a bonus,
According to Professor of Genomic Technologies Alexander Hoischen, the number of diagnoses is likely to continue increasing. His team has previously connected genetic abnormalities to a variety of disorders.
“Thanks to long reads, we obtain an even more complete view of DNA and can detect complex and hard-to-find abnormalities. We then link these to specific conditions. In this way, our knowledge grows, and we can make more diagnoses.”
Long-read sequencing also played a key role at the recent Undiagnosed Hackathon in Nijmegen, organized by UMCNL.
Nearly 150 specialists from Dutch university medical centers worked together to find answers for 33 families still seeking diagnoses. The new test provided detailed DNA maps for all participating families, and when combined with the expertise of the specialists, led to five new diagnoses.
Reference: “Clinical Long-Read Genome Sequencing for Rare-Disease Diagnostics” by Tessa J.J. de Bitter, Bart van der Sanden, Lydia Sagath, Wolfram Höps, Peer Arts, Michelle de Groot, Marjan M. Weiss, Ronny Derks, Amber den Ouden, Simone van den Heuvel, Raoul G.J. Timmermans, Timon van Leeuwen, Jordi Corominas Galbany, Jos G.A. Smits, Lot Snijders Blok, Tom Hofste, Marloes Steehouwer, Nick Zomer, Quentin Sabbagh, Erik-Jan Kamsteeg, Dorien Lugtenberg, Ermanno A. Bosgoed, Richard J. Rodenburg, Su Ming Sun, Arjen R. Mensenkamp, Marjolijn J.L. Ligtenberg, Nicole de Leeuw, Debby M.E.I. Hellebrekers, Alexander P.A. Stegmann, Aimée D.C. Paulussen, Marinus J. Blok, Wendy A.G. van Zelst-Stams, Arthur van den Wijngaard, Helger G. Yntema, Christian Gilissen, Alexander Hoischen and Lisenka E.L.M. Vissers, 12 June 2026,
New England Journal of Medicine
DOI: 10.1056/NEJMc2602512
Never miss a breakthrough:
Join the SciTechDaily newsletter.
Follow us on
Radboud University
Genome Studies Indicate That “Junk” DNA Holds Clues to Common Diseases
A Step Toward Developing Sight-Saving Gene Therapy
Genomic Analysis of Colon Cancer Reveals New Potential Drug Targets
Molecular and Statistical Tools Analyze Complex Differences Between Genomes
The Tomato Genomics Consortium Sequences the Tomato Genome
Cdt1 Protein Has a Role in DNA Replication and Mitosis
Faster and Cheaper Genomics Technique Ready for Takeoff
3-D Image Shows How DNA Packs Itself into a “Fractal Globule”
Researchers Complete Genome Sequence of a Denisovan Human Finger Bone",https://scitechdaily.com/this-new-dna-test-solves-rare-disease-mysteries-that-standard-genetics-misses/,scitechdaily,综合科技,无,2026-06-19T19:22:33+00:00
Scientists Just Discovered the Eye Defies a Long-Held Rule of Vision,2026-06-19,"A Yale-led study uncovered unexpected communication between retinal visual pathways that were thought to operate separately.
Researchers at
Yale School of Medicine (YSM)
have discovered unexpected insights into how the eye handles visual information.
When we view a scene, the visual system quickly separates different features, including color, contrast, and motion, and processes them independently. This process, known as parallel visual processing, helps the brain rapidly interpret the world around us.
Scientists have long believed that this separation begins in the retina and remains intact as information moves through the visual system. However, a new study published in
suggests the pathways are more interconnected than previously recognized. According to the researchers, this integration may improve the ability to detect weak visual signals, such as those encountered in low light.
“We found that while different channels can deliver their own features, they’re also interconnected by underlying electrical circuitry,” says Yao Xue, PhD, a postdoctoral fellow in the department of ophthalmology and visual science at YSM and the study’s first author.
Vision starts with rods and cones, specialized retinal cells that detect light and pass information to neurons known as bipolar cells. Within these cells, visual information related to factors such as brightness, color, shape, and contrast is divided into more than a dozen parallel pathways.
When the researchers examined the synapses of bipolar cells, where cells communicate with one another, they found evidence that these pathways are not entirely separate.
Neurons communicate through two types of synapses: chemical and electrical. Chemical synapses rely on neurotransmitters that carry signals between cells. Electrical synapses, also called gap junctions, allow signals to pass directly through electrical currents. Bipolar cells are generally thought to communicate mainly through chemical synapses.
The researchers discovered that electrical synapses connected many of the bipolar cell pathways that had previously been considered separate in both mouse and human retinas. When they stimulated a single bipolar cell, the resulting
neurotransmitter
release was not confined to that cell’s pathway. Instead, signaling spread across a wider network, creating diffuse, cloud-like activity patterns that revealed extensive communication between different bipolar cell types.
“When we stimulated one bipolar cell, many bipolar cells released neurotransmitters,” says Z. Jimmy Zhou, PhD, Marvin L. Sears Professor of Ophthalmology and Visual Science and principal investigator.
The researchers also identified a specific bipolar cell type, known as BC6, that appeared to coordinate this activity. These cells produced strong signals that spread through the parallel pathways in an organized hierarchy. “People had assumed that the different types of bipolar cells were more or less autonomous,” Zhou says. “But we found a driver among all these cell types that creates this network with a hierarchy.”
While separate pathways allow bipolar cells to process different aspects of visual information efficiently, the electrical connections between them may provide an important advantage when signals are weak.
“If the signal is already very weak and is divided into several channels, there isn’t much left for each channel to process,” says Seunghoon Lee, PhD, a research scientist in the department of ophthalmology and visual science at YSM and co-corresponding author of the study. “The integration is particularly useful for detecting low-contrast signals or signals from very small objects.”
“And the cells aren’t cooperating in a random way,” adds Xue. “There’s a commander within them—BC6—that leads them in relaying signals to the downstream target.”
To investigate the circuitry of bipolar cells, the team combined multiple experimental approaches. These included imaging techniques that tracked cellular activity and neurotransmitter signaling, along with methods that stimulated bipolar cells and recorded responses in neighboring cells.
Studying bipolar cells is challenging because they are located deep within the retina. In many previous studies, researchers sliced retinal tissue to gain access to these cells, a process that can disrupt normal circuitry. In this study, the team instead used a dual patch-clamp technique on fully intact mouse retinas. The method uses electrodes to stimulate specific bipolar cells and measure the responses of connected cells.
“No other lab in the world has been able to pull off these kinds of recordings systematically,” says Zhou. “It is a tour de force of Yao Xue’s PhD thesis work, pairing an innovative approach with exceptional electrophysiological skill.”
The researchers then repeated the experiments using human retinas obtained through the Department of Pathology’s Legacy Tissue Donation Program. According to the team, these are the first experiments of this type conducted in an intact human retina.
Because the retina is part of the central nervous system, understanding how it processes visual information may provide broader insights into how neural circuits function throughout the brain. The findings could also help researchers better understand diseases that affect retinal function, including macular degeneration, glaucoma, and congenital night blindness.
The study also highlights the value of curiosity-driven research in uncovering fundamental biological mechanisms.
“Our experiments didn’t begin with a specific hypothesis but revealed a fundamental processing mechanism in the visual system,” says Lee. “It’s an important reminder of how essential curiosity-driven research is to discovery.”
Reference: “A hierarchical electrical synaptic circuit mechanism for integrative parallel visual processing in the retina” by Yao Xue, Yue Fei, Marcello DiStasio, Sean J. Miller, Brian P. Hafler, Liang Liang, Seunghoon Lee and Z. Jimmy Zhou, 19 February 2026,
DOI: 10.1016/j.neuron.2025.12.042
The research reported in this news article was supported by the
National Institutes of Health
(awards R01EY034652, R01EY036472, R01EY034697, and P30EY026878) and
Yale University
Never miss a breakthrough:
Join the SciTechDaily newsletter.
Follow us on
Cell Biology
Ophthalmology
Yale University
New Layer of the Human Cornea Discovered
Combination of Immune Stimulating Antibodies Shows Promising Results Against Advanced Melanoma
Scientists Peer Into a Cell in Real Time
Researchers Uncover Molecular Pathway to Grow New Arteries
A Closer Look at the Antifreeze Protein That Allows Siberian Beetles to Survive
Understanding How Cells Package Fat
Optogenetics Regulates Metabolic Activity in the Membranes of Cells
Scientists Restore Basic Elements of Vision in Live Mice
Gene Therapy Improves Eye Function in Patients",https://scitechdaily.com/scientists-just-discovered-the-eye-defies-a-long-held-rule-of-vision/,scitechdaily,综合科技,无,2026-06-19T19:22:35+00:00
Ancient Black Holes May Have Survived a Cosmic Era Before the Big Bang,2026-06-19,"What if some of the Universe’s oldest objects are actually older than the
A new study from the
University of Portsmouth
suggests that ancient black holes may have survived from a time before the Universe as we know it existed. These hypothetical relics, described as “cosmic fossils,” could have endured a dramatic cosmic transition and may still be scattered throughout the cosmos today. If they exist, they could help solve one of astronomy’s biggest mysteries: the identity of dark matter, the invisible substance that appears to outweigh ordinary matter and shape the growth of galaxies.
The research challenges the conventional view that everything began with a singular Big Bang. Instead, it explores a “bounce” scenario in which the Universe was once contracting before reversing into the expansion we observe today. In that picture, some structures may have survived the transition, carrying information from a cosmic era that predates the Universe’s earliest observable light.
Professor Enrique Gaztañaga, lead author of the study from the University of Portsmouth’s Institute of Cosmology and Gravitation and the Institute of Space Sciences in Barcelona, said: “For almost a century, cosmologists have traced the history of the Universe back to a single dramatic moment known as the Big Bang. In the standard picture, space and time emerged from an extremely hot, dense state around 13.8 billion years ago, followed by billions of years of cosmic expansion and galaxy formation.
“This model has been remarkably successful. It explains the Cosmic Microwave Background – the faint radiation left over from the early Universe – and accurately predicts how galaxies are distributed across vast cosmic distances.
“But some of the deepest mysteries in physics remain unresolved. We still don’t know what triggered the Big Bang, why the Universe began in such a special state, what caused the brief burst of rapid expansion known as inflation, or what the invisible ‘dark matter’ is that outweighs ordinary matter by about five to one.
“Our research explores a possibility that could connect several of these puzzles: the Universe may not have begun with a singular bang at all, but instead emerged from a cosmic bounce mimicking inflation, with some of the oldest objects in the Universe potentially surviving as relics from before it.”
According to the researchers, some black holes may have formed before the bounce and persisted through the transition into the expanding Universe. These ancient objects could still affect the structure and evolution of galaxies billions of years later.
Other black holes may have formed shortly after the bounce. In this scenario, unusually large density fluctuations in the early Universe would have created dense concentrations of matter that collapsed more easily under gravity, helping black holes and other large cosmic structures form at an early stage.
In Einstein’s theory of general relativity, the Big Bang is associated with a singularity, a state where density becomes infinite and the known laws of physics no longer apply. Many physicists view this as evidence that current theories cannot fully describe the Universe’s earliest moments.
One proposed alternative is a bouncing cosmology. In this model, the Universe begins as an enormous cloud that contracts before reversing direction and expanding again. Rather than reaching an infinite singularity, it attains an extremely high but finite density before rebounding.
Professor Gaztañaga added: “Singularities often signal that our theoretical description has reached its limits. A bounce provides a way for the Universe to transition from contraction to expansion without requiring new exotic physics.”
The team argues that such a bounce could emerge naturally from quantum physics. At extremely high densities, quantum effects can generate pressure that prevents matter from being compressed indefinitely, a process already known to stabilize dense objects such as white dwarfs and neutron stars and reproduce the inflationary expansion phase.
In the new model, the same type of quantum pressure could operate on the scale of the entire Universe. As contraction progresses, that pressure could stop the collapse and trigger renewed expansion.
The researchers suggest this mechanism may also address two major cosmological puzzles. It could help explain inflation, the period of rapid and remarkably uniform expansion in the early Universe. It may also offer insight into the present-day acceleration of cosmic expansion, which is commonly attributed to dark energy.
One particularly intriguing prediction is that some structures created during the contracting phase may have survived the bounce. The team’s calculations indicate that compact objects larger than about 90 meters (295 feet) could pass through the transition and emerge in the expanding Universe.
Potential relics include
gravitational waves
, density fluctuations, and ancient black holes.
These surviving black holes could also be linked to dark matter. If enough formed during the bounce, they might account for a substantial portion of dark matter, or possibly all of it.
The model may also help explain recent
James Webb Space Telescope
observations of unexpectedly massive objects in the young Universe, often referred to as “little red dots.” Many astronomers believe these sources are associated with rapidly growing black holes that appeared surprisingly early in cosmic history.
“If massive black holes already existed immediately after the bounce, the early Universe would not need to start from scratch when building the first galaxies,” Gaztañaga said.
The theory offers several ways to test its predictions. Future observations could search for relic gravitational waves from an earlier cosmic era or look for subtle signatures in the cosmic microwave background that preserve evidence of conditions before the Big Bang.
“Much work remains to test these ideas,” Gaztañaga added. “But if the Universe did experience a bounce, the dark structures shaping galaxies today could be remnants from a cosmic epoch that preceded the Big Bang.”
Reference: “Cosmological bounce relics: Black holes, gravitational waves, and dark matter” by Enrique Gaztañaga, 24 February 2026,
Physical Review D
DOI: 10.1103/pr4p-6m49
Never miss a breakthrough:
Join the SciTechDaily newsletter.
Follow us on
Astrophysics
“Cannibal Stars” and Black Holes May Have Formed in the Universe’s First Second
Physicist Challenges the Idea That Time Had a Beginning
Scientists Provide a Theory on How the Universe Became Filled with Light
Researchers Use New CMB Data to Analyze the First Hundred Thousand Years of Our Universe
NASA Data Suggests Black Holes Abundant Among the Earliest Stars
Supercomputer Simulations Present a New View of Black Hole Jets and Accretion Disks
The Brightest Flare Ever Observed From Sagittarius A*
Calculations Show the Ideal Time to Study the Cosmos
The Bolshoi Simulation: Boxing the Universe",https://scitechdaily.com/ancient-black-holes-may-have-survived-a-cosmic-era-before-the-big-bang/,scitechdaily,综合科技,无,2026-06-19T19:22:36+00:00
What if Time Isn’t Fundamental? Physicists Just Tested the Idea in the Lab,2026-06-19,"A quantum “mini universe” made from ultracold atoms revealed that time can emerge from entropy changes inside a system, offering experimental insight into one of physics’ deepest mysteries.
A scientist at the
University of Birmingham
has created a “mini universe” that could help answer one of science’s most fundamental questions: What is time?
In a study published in
Physical Review Research
, Professor Giovanni Barontini demonstrates that it is possible to track the passage of time without relying on a clock. The research introduces a model in which a form of time emerges naturally from the behavior of the system being studied.
Some physics theories, including the Wheeler–DeWitt equation, suggest that time is not a fundamental property of the universe. Instead, the universe may exist as a single quantum state that does not change, with particles displaying both wave-like and particle-like behavior. In this view, there is no external clock, and the experience of time arises from relationships between different parts of the system.
To explore this idea, Barontini created a sealed quantum system using a cloud of 24,000 ultracold atoms, cooled to just a few billionths of a degree above
absolute zero
. The atoms were trapped and separated by a thin barrier created with two laser beams of different frequencies, forming an observed “bright” region and an unobserved “dark” region.
The bright region repeatedly expands and contracts, resembling a
followed by a Big Crunch, a hypothetical scenario in which the universe’s expansion eventually reverses. Because the sequence of events can be reconstructed from inside the system, the experiment does not require any reference to an external clock.
The results show that time can emerge from changes taking place within a quantum system rather than existing as an independent external feature.
The mini universe also revealed that time can arise from entropy, the spread or disorder of particles within a system. Atoms were able to move between the bright and dark regions while the system remained isolated from the outside world.
As atoms moved in and out of the bright region, the distribution of particles changed. When that distribution increased or decreased, the system effectively moved forward in time. When the distribution remained unchanged, time effectively came to a halt. Barontini describes this process as “entropic time” because it:
Professor Barontini said: “In some theories of the universe, especially quantum gravity, time doesn’t appear as a built‑in feature. Yet in everyday life, time flows from past to future – why is this so, when most basic laws of physics work the same way forwards and backwards?
“This study provides the first controlled experimental evidence that ‘time’ can be defined by changes within a system rather than as the external ‘ticking clock’ we think of as time. It offers new insight into the nature of time in quantum gravity that could be used to describe dynamics just as effectively as conventional time.”
The study also shows that a version of the Schrödinger equation, one of the central equations of quantum mechanics, can be expressed using entropic time. This allows researchers to predict how a quantum system’s “probability cloud” evolves over time.
The research tackles a long-standing question in physics: if certain theories of the universe contain no built-in clock, how can events be placed in order without an external measure of time?
Barontini showed that the system still follows the standard laws of quantum physics, demonstrating that questions about the nature of time, once limited to theories of the entire universe, can now be investigated through controlled laboratory experiments.
The experiment provides a valuable testing ground for ideas in quantum cosmology and gravity, making it possible to examine concepts related to the early universe under laboratory conditions.
The method could eventually be applied to more complex systems, allowing scientists to study the physics of both the Big Bang and the Big Crunch. It may also help researchers simulate black holes in the laboratory and evaluate competing theories about how time emerges in the universe.
Reference: “Testing the problem of time with cold atoms” by Giovanni Barontini, 11 June 2026,
Physical Review Research
DOI: 10.1103/1h9j-df4k
Never miss a breakthrough:
Join the SciTechDaily newsletter.
Follow us on
Quantum Mechanics
Quantum Physics
University of Birmingham
Breaking Light Speed: The Quantum Tunneling Enigma
The Experimental Design of a Space-Time Crystal
Interpretation of Heisenberg’s Principle is Proven False
New System Converts Laser Beam Into Controlled Stream of Single Photons
Quantum Bits Store Data for Nearly Two Seconds Using Laboratory Grown Diamonds
Experiment Shows That Light Defies the Principles of Classical Physics
“Schrödinger’s Hat” Conceals Matter Waves Inside an Invisible Container
Simulating Quantum Walks in Two Dimensions
Evidence of Elusive Majorana Fermions Raises Possibilities for Quantum Computing",https://scitechdaily.com/what-if-time-isnt-fundamental-physicists-just-tested-the-idea-in-the-lab/,scitechdaily,综合科技,无,2026-06-19T19:22:38+00:00
