title,published_at,content,url,source_name,domain,sub_domain,crawled_at
QuantumScape signs Honda as solid-state battery partner - electrive.com,2026-06-19,"QuantumScape has entered a research cooperation with Japanese automaker Honda. Both parties aim to advance the development of solid-state batteries. The collaboration is designed to span several years. Solid-state battery specialist QuantumScape is primarily known to us for its partnership with VW.
Image: QuantumScape
The partners intend to further develop QuantumScape’s QS battery platform, the company’s solid-state battery architecture. The agreement has been signed with Honda R&D, the development arm of Honda Motor, which will serve as QuantumScape’s contractual partner. The collaboration is structured as a multi-year research programme aimed at advancing solid-state battery technology and the associated manufacturing processes.
According to QuantumScape, the current agreement follows a ‘technology evaluation agreement with QS, which included an in-depth, hands-on technical study of QS’s solid-state technology platform as well as competitive benchmarking across a range of standard technical tests.’ After successfully completing this assessment, the joint development work is now set to begin.
“QS technology demonstrated compelling and unique advantages during our evaluation,” said Atsushi Ogawa, Chief Operating Officer, Research Center of Excellence, Honda R&D Co., Ltd. “We see potential for QS technology to add value across a range of applications, including automotive, and we are excited to move forward into the next phase of our partnership.”
“Honda is a leading global automaker renowned for its engineering excellence and product quality across automotive and other applications worldwide, and its evaluation represents one of the most rigorous assessments of our technology to date,” said Dr. Siva Sivaram, CEO and President of QS. “This agreement reflects the growing confidence in QS solid-state lithium-metal batteries to enable safer, higher-density energy storage.”
For context: QuantumScape is one of the most promising solid-state battery developers in the USA and is primarily backed by Volkswagen. At the end of 2025, the company announced that it had completed the installation of key equipment for the pilot production of its so-called QSE-5 solid-state cells in San Jose, California,
followed by the inauguration of the pilot line in February
This so-called Eagle Line is an automated production line for manufacturing QuantumScape’s battery cells and is intended to serve as the foundation for future series production. However, QuantumScape does not plan to engage in large-scale production itself; instead, it aims to realise gigawatt-hour-scale projects through licensing agreements with partners.
In October, QuantumScape announced that it had
started shipping B1 samples of its QSE-5 cell
. The company did not disclose which customers received the samples. However, Volkswagen is likely to be among them, given its long-standing relationship with QuantumScape, which was
further expanded in summer 2025.
A key element of the partnership is the
Ducati V21L electric motorcycle
, which serves as a test platform for solid-state battery technology. As Honda is not only a car manufacturer but also one of the world’s largest motorcycle producers, the new research collaboration could potentially place particular emphasis on two-wheeler applications. However, neither company has confirmed such a focus.
What is clear:
The QSE-5 cell
is set to become QuantumScape’s first commercial product—with a capacity of 5 Ah, an energy density of over 844 Wh/l, and a charging time of 12.2 minutes from 10% to 80% state of charge (SoC). In October 2024, the manufacturer began small-scale production and delivery of B-samples for testing by automotive customers, according to its own statements.
The QSE-5 is specifically described by the company as a solid-state battery cell measuring 84.5 mm × 65.6 mm × 4.6 mm. The cell is also designed to function at low temperatures down to -30 °C. The QSE-5 was preceded by two cell prototypes at QuantumScape: The ‘A0’ cell samples were
delivered to automotive manufacturers for testing just before Christmas 2022
. In March 2024, the so-called
‘Alpha-2’ cells
about „QuantumScape signs Honda as solid-state battery partner“",https://www.electrive.com/2026/06/19/quantumscape-signs-honda-as-solid-state-battery-partner/,electrive,电池,电气化交通工具,2026-06-19T19:19:22+00:00
Panasonic to Meet Data Center Energy Needs with Kansas Factory,2026-06-19,"Panasonic expands Kansas EV battery factory to produce energy storage for data centers, addressing growing changes in global energy demands.
June 18, 2026
EV cell production line inside Panasonic's De Soto, KS EV battery factory.
The rapid expansion of data centers, fueled by advancements in AI infrastructure, cloud computing, and hyperscale operations, has significantly increased the demand for advanced energy storage systems. Recognizing this trend, Panasonic is redefining its approach to energy storage by strategically repurposing its Kansas EV battery factory to support data center applications as well. This decision, announced during the Panasonic Group Investor Day 2026, reflects the company’s commitment to addressing global energy challenges while maintaining its leadership in the automotive battery sector.
The energy storage industry is undergoing rapid transformation, driven by the increasing reliance on
AI infrastructure and hyperscale
computing. Panasonic’s revised sales target for energy storage systems, now projected at 950B Yen for FY3/29, underscores the growing demand for reliable energy solutions in data centers. By repurposing its Kansas factory, Panasonic is capitalizing on this demand while maintaining flexibility to support its automotive battery business.
Battery Breaking-News Headlines
Akira Waniko, Group CFO, highlighted the company’s dual strategy during the Investor Day, stating, “In Japan, converting existing production lines is considered the most efficient way to respond to increasing demand; therefore, in the near term, we are flexibly utilizing our facilities in Japan and progressively shifting capacity toward energy storage systems. On the other hand, our Japan factory is expected to support a recovery in the automotive battery business in the future, and we do not assume a permanent shift to data center applications.”
Panasonic changes in global energy demand. Courtesy of Panasonic.
Originally designed to
manufacture Tesla’s 2170 cells
, the $4 billion Kansas factory is now being repurposed to produce battery cells for data center applications. According to
, mass production at the Kansas factory is set to begin by FY2028, marking a significant milestone in Panasonic’s diversification efforts.
Waniko elaborated on the factory’s role, noting, “While the initial phase will be managed with capacity in Japan, in the latter phase—when further demand expansion is anticipated—we plan to utilize capacity at the Kansas factory and advance the shift in production. In addition, given the current strong demand and the potential for further upside, we intend to steadily proceed with capacity expansion at the Kansas factory.”
Battery Show Europe 2026: Technology Highlights From the Show Floor
As Panasonic prepares to begin mass production of data center batteries by FY2028, the company is setting the stage for long-term success in the energy storage industry. By leveraging its expertise and adapting to market trends, Panasonic is poised to drive innovation and profitability in both automotive and data center applications.
Maria Guerra
Senior Editor-Battery Technology, Informa Markets
Maria L. Guerra is a Senior Editor at
Battery Technology
, blending her engineering background with a passion for technology journalism. She holds a Bachelor of Science in Electrical Engineering from Universidad Metropolitana in Caracas, Venezuela, and a Master of Science in Electrical Engineering from NYU Tandon School of Engineering.
Guerra's career spans power systems engineering, oil & gas consulting, and technical writing and editing. She worked for several years at Kellogg, Brown & Root Ltd. (KBR) in the UK, conducting power system studies and providing technical support for offshore and onshore projects. During her internship at Pequiven S.A. in Venezuela, she trained neural networks using MATLAB (Kohonen Map) to estimate electrical circuit variables for oil wells (e.g., voltage, current, and power).
In addition to her engineering roles, Guerra worked as a freelance technical editor, refining complex technical content for clarity and accuracy. She later became a Power/Analog Editor at
Electronic Design
, covering advancements in the semiconductor market, focusing on power/analog electronics systems.
Battery Technology
, Guerra now delivers in-depth coverage of battery manufacturing, EV advancements, energy storage systems, and the evolving landscape of critical minerals and second-life batteries. She is passionate about uncovering the stories that shape the future of electrification, from cutting-edge battery innovations to policy shifts driving sustainable energy.
Guerra is also a member of
The Battery Show North America Advisory Board
, where she contributes her expertise to advising on industry trends and speaker selection for The Battery Show North America, while helping to shape discussions on battery technology and electrification. She was part of the award-winning Battery Technology team recognized with a
Neal Award for Best Coverage of the 2024 Election
Neal Award for Best Explanatory Content
in 2026 for her coverage of battery breakthroughs.
Maria Guerra is based in Brooklyn, NY, and can be reached at
[email protected]
See more from
Maria Guerra",https://www.batterytechonline.com/battery-news/panasonic-to-meet-data-center-energy-needs-with-kansas-factory-production,Battery Tech Online,电池,无,2026-06-19T19:19:58+00:00
McCormick Hits 100% Sustainable Sourcing for Top Ingredients,2026-06-19,"McCormick Hits 100% Sustainable Sourcing for Top Ingredients
Prioritise Us
McCormick reaches 100% sustainable sourcing for top ingredients through farmer programmes spanning 11 countries and 57,000 farmers globally
McCormick has published its 2025 Purpose-led Performance Report, which details the completion of the company's 2025 commitments and outlines progress in responsible sourcing, climate action, operational resilience and employee wellbeing.
The flavour manufacturer and distributor was founded in 1889. Since its inception, it has expanded from a small Baltimore spice company into a global operation.
According to the report, McCormick achieved 100%
sustainably sourced
volumes for its top five ingredients. These are black pepper, cinnamon, oregano, red pepper and vanilla.
The company also achieved the same for clove and sage. This could show enhanced supply reliability and quality consistency.
has been investing in farming communities to build resilience. The aim is to secure access to ingredients over the long term.
The company is also working to reduce environmental impact across its operations and value chain. This could drive efficiency gains.
Brendan M. Foley, Chairman, President & Chief Executive Officer of McCormick & Company, says: ""In a year marked by continued change and global complexity, I am proud of the meaningful progress we have made in advancing our Purpose-led Performance commitments.
""Our teams have remained focused and resilient, strengthening how we operate while delivering lasting value for our people, communities, and the planet.""
McCormick launched its 'Grown for good' certification in 2019. Through this programme, the company has collaborated with suppliers across 23 commodities in 11 countries.
The focus has been on building farmer resilience and providing
climate-smart agricultural training
. According to the report, the company has impacted more than 57,000 farmers to strengthen livelihoods and resilience in key sourcing regions.
In 2024, McCormick launched programmes with nearly 100 US farmers. These programmes abated approximately 50,000 metric tons of CO₂e.
Nearly 60,000 acres were placed into regenerative practices. This could advance the company's transition towards a more regenerative food system.
McCormick completed a risk assessment covering 100% of its global agricultural spend. The assessment aligns with the UN Guiding Principles and OECD Guidelines.
Human rights,
environmental and governance risk indicators
were integrated directly into the procurement governance model. In-depth participatory impact assessments were conducted in eight priority countries.
These assessments inform targeted supplier engagement, as well as helping to develop tailored action plans for responsible labour and environmental practices.
McCormick reduced its Scope 3 GHG
This is measured against a 2020 baseline. McCormick achieved a near 90% response rate from more than 100 suppliers.
These suppliers represent over half of its Scope 3 emissions. Enhanced primary data helps the procurement team understand and report value chain emissions.
McCormick is working on capabilities to map out the specific emission factors of raw materials. Kathy Rostkowski, Chief Sustainability Officer at McCormick & Company, says: ""As I've stepped into the role of Chief Sustainability Officer, I am proud to build on the strong foundation we have established.""
Kathy adds: ""We are closing out our 2025 PLP commitments with encouraging progress and a clear view of where to go next.
""We are demonstrating that trust is earned when sustainability is practised, not promised.""
In 2025, McCormick sustained 80% circular packaging for a second consecutive year. The company aims for 100% by 2030.
McCormick increased its PCR materials usage to 6% of total plastic packaging, up from 3% in the year prior.
In the EMEA region, procurement and
supply chain teams
invested in sachet production line modifications. These changes adapt to evolving sustainability regulations.
The modifications also test circular formats over the long term. This could support the company's packaging targets.
Chairman, President and Chief Executive Officer
Chief Sustainability Officer",https://supplychaindigital.com/news/mccormick-hits-100-sustainable-sourcing-for-top-ingredients,Supply Chain Digital,综合媒体,关键原材料/矿产,2026-06-19T19:20:29+00:00
Schneider Electric: Top of Gartner's Supply Chain Rankings,2026-06-19,"Schneider Electric: Top of Gartner's Supply Chain Rankings
Prioritise Us
For the fourth consecutive year, Schneider Electric has taken top spot in the 2026 Global Supply Chain Top 25, largely due to its transformation ambitions
Gartner's 2026 Global Supply Chain Top 25 rankings shine a light on some of the biggest global supply chain organisations, as well as the macro trends responsible for their success.
The standings were decided with a composite scoring system, which included a peer rating, along with revenue, change in ROPA, gross margin and ESG points among other factors.
As a result, making up the top three global supply chains were NVIDIA in second place and Walmart, which notably climbed 10 places year-on-year.
Schneider Electric came out on top for the fourth year in a row, in an era of
operations defined by automation
This year marks the final year of the global energy management and digital automation firm’s three-year Impact Supply Chain transformation, as Schnieder Electric was commended for integrating
autonomous workforce capabilities
and end-to-end resource orchestration within its operations.
Talking about the winner’s supply chain excellence, Laura Rainier, Senior Director Analyst, Gartner Supply Chain practice, says: “Schneider Electric continues to demonstrate how organisations can balance bold transformation ambitions with disciplined execution.
“Its approach to AI-enabled orchestration, circularity and workforce transformation exemplifies how supply chain leaders are preparing for the autonomous business era.”
This approach to moving the supply chain function forward has never been more crucial. Leaders noted in this year’s rankings have had to demonstrate operational excellence against a backdrop of global instability.
Gartner noted three macro trends in the supply chain sector. Autonomous workforces was noted as a growing trend among leading organisations, as we move into a future that will see
machines and humans collaborate effectively
Other patterns identified among industry movements were network-centric strategies, where leaders focused on increasing resilience to reduce cross-border operational challenges and end-to-end supply chain orchestration, which demands
increasingly strategic decision-making
and collaborative planning.
“This year, leaders are differentiating themselves by building autonomous workforces, investing in network-centric strategies and orchestrating supply chains end-to-end across increasingly complex ecosystems,” adds Laura.
“Leading supply chains are embracing AI not simply to automate tasks, but to fundamentally redesign how work gets done between people and machines.”
In addition to the top three supply chains recognised by this accolade, other high-ranking operations leaders include L'Oréal, Danone, and AstraZeneca, which were all awarded top-10 positions for their supply chain capabilities.
Gartner also noted that many of the Top 25 firms are focusing on manufacturing and sourcing in the same region where they are sold, which helps minimise the disruption and
challenges associated with operating across borders
Away from the Top 25, Gartner also recognises supply chain giants with a select category: The Masters. Those celebrated for long-term supply chain excellence this year include Amazon, Apple, Procter & Gamble and Unilever, who all retained their Masters category status.
To compete with these masters and other logistics companies who have been recognised with this listing,
supply chains need to be more resilient
and agile than ever before.
Technological shifts will likely continue, whether in the form of more robots or AI sensor capabilities.
They will require companies to prepare both their people and their organisational structures in ways that combine technology and human innovation to foster an ever more strategic mindset that drives continuous improvement.",https://supplychaindigital.com/news/schneider-electric-top-of-gartners-supply-chain-rankings,Supply Chain Digital,综合媒体,关键原材料/矿产,2026-06-19T19:20:31+00:00
Telo confirms 400 kW sustained charging for its tiny electric truck,2026-06-19,"Fred Lambert
| Jun 19 2026 - 8:50 am PT
Telo confirmed that its Mini-sized MT1 electric truck will charge at 400 kW sustained — a charging rate that puts it in the company of luxury EVs costing two to three times as much.
The startup also revealed a dual 800V/400V split-pack battery architecture designed to maximize performance on any fast charger, not just the latest high-voltage stations.
The announcement, made by CTO Forrest North in a
video update
, comes on the heels of Telo securing a body manufacturing partner in Schwab Industries, a Michigan-based Tier 1 automotive supplier that will produce the MT1’s body-in-white structure. First customer deliveries of roughly 500 units are targeted for late 2026.
The MT1 will use two 400V battery packs that can operate in parallel at 400 volts or switch to series configuration for 800V charging. This split-pack design allows the truck to take full advantage of 800V high-power chargers while maintaining strong performance at the more common 400V fast chargers that make up the majority of today’s DC fast charging network.
North emphasized that this was a deliberate engineering decision: “Vehicles that just go for pure 800 volts end up being compromised at 400-volt chargers. And because there are more 400-volt chargers out there than there are 800-volt chargers, that’s too big of a limitation for our customers.”
The approach mirrors what a handful of other EVs do, but North noted it was “a big packaging challenge” given the MT1’s compact 152-inch footprint — the same length as an electric Mini Cooper. Telo claims it has “one of the most dense series to parallel high voltage packs that exists.”
Other automakers have tackled 400V compatibility differently. The Porsche Taycan uses a DC-DC charge booster that limits it to around 150 kW at 400V stations.
Hyundai’s E-GMP vehicles
use the rear motor to step up voltage, achieving roughly 135 kW at 400V Superchargers. Telo’s split-pack approach should theoretically deliver stronger 400V performance, though the company hasn’t specified the exact charging rate at 400V stations.
The more significant claim is that the 400 kW charging rate is sustained, not a brief peak that tapers within seconds. North directly addressed the industry practice of advertising peak charging rates that last only moments: “In the past we’ve seen some vehicles be able to charge at a very high charge rate but only for a few seconds. We know that that doesn’t fool anybody; we know it’s about sustained charge. That’s what brings the actual charge time down.”
This is a notable distinction. The Lucid Gravity, one of the few EVs currently capable of 400 kW charging, maintains that peak rate for roughly 90 seconds before tapering linearly. The
on the Neue Klasse platform also advertises 400 kW but follows a similar taper pattern. Tesla’s Model Y, by comparison, maxes out at 250 kW.
If Telo can deliver genuinely sustained 400 kW charging, the MT1 would stand out among EVs at any price point — and it starts at $41,520.
North attributed the improvement to rapid advances in battery cell technology, noting that cells Telo is sourcing today have 20% more energy density and roughly one-fifth the internal resistance of cells available just a year ago. Lower internal resistance means less heat generation during fast charging, which is what allows higher sustained power without thermal throttling.
The charging announcement adds to a string of recent milestones for Telo. The company has
raised roughly $30 million
, including a $20 million Series A backed by Tesla co-founder Marc Tarpenning, and has accumulated over 12,000 preorders representing more than $600 million in potential revenue.
The MT1 offers a 60-inch truck bed — comparable to a Toyota Tacoma — despite being five feet shorter. Battery options include a 77 kWh standard pack (260 miles range) and a 106 kWh long-range pack (350+ miles). The dual-motor AWD configuration delivers 500 horsepower and a 4-second 0-60 time.
With the Schwab Industries partnership now in place for body manufacturing and certification activities underway, the initial run of approximately 500 units will target high-deposit customers and fleet buyers before broader production ramps up. Telo aims to produce around 5,000 trucks per year.
The sustained 400 kW charging claim is the headline here, and it’s a bold one. Most EVs that advertise 400 kW peak rates see dramatic taper within the first minute or two. If Telo delivers on this, the MT1 would charge faster than vehicles costing $50,000 or more.
The dual 800V/400V architecture is the right call. We’ve been tracking how 800V-only vehicles struggle at 400V chargers — and with the majority of the fast charging network still running at 400 volts, optimizing for real-world infrastructure rather than spec-sheet bragging rights shows engineering maturity.
That said, Telo is still a startup with $30 million in funding trying to bring a vehicle to production — a feat that has humbled or destroyed far better-capitalized companies. The company wisely isn’t announcing specific charge times yet, which suggests final validation is still in progress. We’ll need to see actual charging curve data at real stations before this moves from impressive claim to confirmed capability. But the technical approach is sound, and the momentum, body manufacturing partner, 12,000 preorders, improving battery cell performance, is heading in the right direction.
But to bring a passenger vehicle program to market, you generally need in the hundreds of millions of dollars.
If you’re considering a compact truck like the Telo MT1, home solar can dramatically cut your charging costs. With electricity rates climbing nearly 10% last year, home solar protects you against future rate increases. And with lease and PPA options, you can go solar with zero upfront cost and start saving immediately. If you want to find the best deal, check out
. It’s a free service with hundreds of pre-vetted installers competing for your business, so you save 20 to 30% compared to going it alone. No sales calls until you pick an installer.
Get your free quotes here
Subscribe to Electrek on YouTube for exclusive videos
and subscribe to the
Fred is the Editor in Chief and Main Writer at Electrek.
Through Zalkon.com, you can check out Fred’s portfolio and get monthly green stock investment ideas.
Get an edge on MMA with the best stats
EnergySage helps you get the best price possible on a home solar installation for free and without hassel.",https://electrek.co/2026/06/19/telo-confirms-400-kw-sustained-charging-tiny-electric-truck/,Electrek,电池,EV,2026-06-19T19:21:18+00:00
