title,published_at,content,url,source_name,domain,sub_domain,crawled_at
The inevitable weakness of metrics,2026-06-19,"There are plenty of useful things a metric can reveal. There are even more it can obscure or corrupt. It took me well over a decade of tracking my own life in ever greater detail to fully appreciate this duality, which probably reveals something about both me and the nature of measurement.
Like a lot of people bitten by the self-quantifying bug, I initially started gathering personal data to pursue a nebulous collection of goals and desires. As a sedentary technology journalist, I wanted to feel better physically and emotionally, to get outside more, and—where possible—to bring order to some of the messiness and uncertainty of my daily existence. These all seemed to be things that could be improved with the cool clarity of numbers.
Self-quantifiers often get stereotyped as obsessive self-optimizers (and
many of them are
), but my reasons for producing and collecting personal data were less about
life-maxxing
and more about life meaning—at least at first. As most people who know me will attest, I do not have now, nor have I ever possessed, a “productivity mindset.” I’m also not all that interested in life hacks, shortcuts, or new ways to compare myself with other people. Instead, what I wanted out of metrics—what I hoped I could divine from a never-ending stream of numbers about my health, work, and social life—was something more elusive: self-knowledge. This was my first mistake.
The idea that the more we know, the better is so profoundly embedded in our culture that it feels weird to even point it out. Since at least as far back as the Enlightenment, the primary way we’ve all agreed to go about knowing more has been through measurement and quantification. After all, more knowledge—more
—leads to better decisions, which leads to happier, more fulfilled people. Or so we’re told, and with increasing frequency in the era of AI.
magazine editors, Gary Wolf and Kevin Kelly, coined the term “quantified self” in 2007 and helped launch the movement we are all now helplessly a part of, they were essentially selling this very idea. “Unless something can be measured, it cannot be improved,”
wrote Kelly in an early blog post
, doing his best impression of
. “So we are on a quest to collect as many personal tools that will assist us in quantifiable measurement of ourselves.” Almost 20 years later, that quest is easier than ever thanks to a flood of devices, apps, and websites all designed to help us build our self-­knowledge through numbers.
My first tool was a small, plastic clip-on Fitbit I started using in 2011. It did one thing: count the number of steps I took in a day. As a lifelong video game player, I was already well acquainted with the
motivational power of simple scoring systems
, and I hoped my new gadget would offer the gentle numerical nudge I thought I needed to step away from my Twitter feed and, if not touch grass, at least walk next to some. Walking also seemed to be one of the few times I had what could charitably be called intelligent ideas, which seemed like another promising by-product of doing more of it.
Alas, that was short-lived. I can’t tell you precisely when “getting out into nature more” or “thinking smarter thoughts” stopped mattering to me as goals, but I suspect it took no more than a few weeks. What I can say with certainty is that my initial goal of 6,000 daily steps quickly turned into 10,000, which then jumped to 15,000 and eventually settled at 20,000 for years. Stories about becoming
a “steps guy”
are clichéd at this point, and they’ve earned that status for a reason.
It didn’t take long for me to trade in pedometers for heart-rate monitors (I also started running), smartwatches, sleep-tracking rings, and an embarrassing number of macronutrient-­tabulating apps. Outside the health and fitness realm, my early career as a journalist also happened to coincide with the rise of social media and web analytics tools like
, which promised to further quantify ­difficult-to-measure aspects of my life, like “job success” and “impact,” by tracking things like page views, followers, retweets, likes, and all sorts of other attentional metrics that now carry great weight.
Metrics inevitably redefine your core sense of what’s important, whether you’re aware of the trap or not.
Ultimately, during the 10-plus years I diligently tracked my heart rate, steps, active calories, sleep, story engagement time, stress levels, and other metrics, I gained virtually nothing in terms of greater self-knowledge. (I suppose I did learn that I liked to make numbers go up and down, but who doesn’t?) The swirl of data that followed me everywhere did not lend additional meaning or insight to the way I relate to myself, my work, or the important people in my life. In fact, the more I used numerical proxies, the worse I felt about pretty much everything.
What I did learn were two important lessons about what happens when you try to quantify the minutiae of your life. First and foremost, whatever the amount of data you’re currently collecting about yourself, it will never feel sufficient. There’s always a new metric around the corner, a better way for a tracker to remix its readings and more accurately measure what’s “important”: heart rate variability, daily stress, exercise “readiness,” cardiovascular or “fitness” ages. Measurement begets more measurement. You can count on it.
PENGUIN PRESS, 2026
The second lesson was less obvious but no less significant. The more personal or nuanced your goals are when you set off on your self-quantifying journey, the more likely it is you will ultimately replace them with some simplified metric or ranking. Want to become a better journalist? Why not use page views and leaderboards as a proxy for success? Enjoy cooking and want to improve? Foodie metrics dictate that more complicated recipes with longer ingredient lists are the answer. Even when we know that the value of good journalism isn’t reflected in how many people read a given story or that the joys of cooking are as much about improvisation and experimentation as about successfully following some complex recipe, it’s hard to resist the allure of a simple score or stat. Metrics inevitably redefine your core sense of what’s important, whether you’re aware of the trap or not.
Over the years, people have invented various terms to describe this phenomenon. In his recent book
The Score: How to Stop Playing Somebody Else’s Game
, the philosopher C. Thi Nguyen calls it “value capture.” Value capture happens, he says, when you adopt external sources of measurement and then let them rule you without adapting them to suit your life. “In value capture, you’re essentially outsourcing your values,” Nguyen writes. “You’re letting an external metric or ranking set what’s important for you.” Crucially, you’re also outsourcing the process of figuring out your
sense of meaning. It’s why my walks quickly shifted from feeling meditative to prioritizing miles.
Individuals, institutions, and indeed entire societies can fall prey to value capture. In fact, once you start noticing it, you start seeing it everywhere—in journalism, education, and business, but also in our food, our hobbies, and, yes, the way we measure our health and happiness. Here’s how Nguyen puts it:
Value capture happens when a restaurant stops caring about making good food and starts caring about maximizing its Yelp ratings. It happens when students stop caring about education and start caring about their GPA. It happens when scientists stop caring about finding truth and start caring about getting the biggest grants. It even happens in religion. A pastor recently told me that his church had become completely obsessed with baptism rates. The higher-ups had established an internal leaderboard in which the pastors competed on monthly baptism rates, and it was starting to dominate everybody’s attention. He’d found himself caring less about the long-term spiritual development of his flock and focusing more on trying to deliver popular sermons that would up his baptism rates and move him up that leaderboard.
At its core,
is trying to untangle a mystery that Nguyen, a specialist in the philosophy of games at the University of Utah, has been thinking about for a long time: Why is it that numbers and scoring systems in games can be the source of so much joy and fluidity and play, but public measures and institutional metrics (i.e., scores that apply to the real world) seem to drain the life out of everything and thrust us all into a bleak mindset of grinding optimization?
To begin to answer this question, he turns to one of the foundational inquiries into the limits of data and quantification, Theodore M. Porter’s 1995 book
Trust in Numbers: The Pursuit of Objectivity in Science and Public Life
Porter, a historian of science who specializes in the social power of numbers, has spent his career looking at why quantification has become so dominant, not just in political and bureaucratic life but everywhere. One of his key insights about the inherent attractiveness of quantification, which he calls “a technology of distance,” is that it “minimizes the need for intimate knowledge and personal trust.” Put another way, metrics travel extremely well between different contexts and are easy to grasp and aggregate.
Whether it’s a student’s GPA or a country’s GDP, these measures are understood by pretty much everyone. But that understanding comes at a price, Porter reminds us: To arrive at a clear metric, you inevitably need to simplify what you’re attempting to measure, often jettisoning heaps of nuanced, qualitative, or open-ended information so that others can find the resulting number legible.
No one (hopefully) believes that a GPA captures in any meaningful way a student’s entire educational experience or aptitude for learning, but we’ve agreed to use it because more qualitative assessments are onerous to wade through and require expertise to decipher and compare. Ditto for the economic metric of GDP, which politicians and societies are now compelled to drive higher and higher because a group of economists once concluded that this figure correlates with general economic well-being.
This is the essential tension at the heart of all data, argues Nguyen. Any institutional quantification, he says, requires that the evaluation procedure and its product be comprehensible across contexts. That profoundly limits what the metric can actually measure. “In value capture, you’re ultimately taking that decontextualized nugget and internalizing it,” he writes. “You’re guiding your life using an evaluative technology that has been engineered to travel between contexts, by stripping it of nuance.”
Every so often I’ll find myself in friendly debate with a “numbers person”—a statistician, an economist, or a friend who’s still a committed self-quantifier. After patiently listening to my measurement-gone-awry examples—the disastrous attempt
to quantify pain as “the fifth vital sign”
in the mid-1990s (which exacerbated the opioid epidemic), or any of the countless examples of
the McNamara fallacy
, where decisions in academia, medicine, and politics are based solely on what’s easily measured—many will insist that I’m misunderstanding or misinterpreting the whole point of measuring. Metrics, they’ll say, are simply a
, and the important questions concern the ends for which they are used. In other words, these unfortunate outcomes amount to user error, not something inherently dangerous or misleading about the nature of measurement.
At some point during these conversations, Goodhart’s Law will invariably come up, usually as an explanation the metrics-minded deploy for why the ends get all mucked up. The principle, which is attributed to the British economist Charles Goodhart, is often expressed as the following: “When a measure becomes a target, it ceases to be a good measure.” I have a profound dislike for Goodhart’s Law, not because I think it’s untrue, but rather for the way it gets interpreted.
As Nguyen notes, Goodhart’s Law says very little about why metrics fail to capture what’s important—or what to do about it. Find better measures, some will conclude. Don’t let metrics become targets, others will insist. These are not helpful takeaways.
measurements, I would argue, are in fact targets, whether you intend them to be or not. Metrics inevitably present one direction or option as better, Nguyen writes in
—“longer lifespans, faster student graduation rates, more page views, higher customer satisfaction scores.” What people are talking about when they bring up Goodhart’s Law isn’t human error; it’s actually a fundamental problem with measurement itself.
I want to be clear here: Measurement can and does serve a number of vital functions. It has in a very literal sense made the modern world possible, with all its life­-saving, suffering-reducing, and awe-
inspiring scientific breakthroughs. When used with care and diligence, metrics can make our progress (or lack of it) clearer and more transparent. Are we decreasing carbon dioxide emissions or not? They can also introduce accountability into formerly opaque systems, such as by measuring whether a company is complying with state and federal regulations. They can even make us more objective, reduce biases, and galvanize us to act.
But as Nguyen points out throughout
, the fundamental weakness of metrics comes when we use them to pursue subtler, more personal goals. What I think many of us miss—what I
I certainly missed—is that there are always trade-offs when you try to distill something important down to a data point. When we turn to metrics to understand ourselves, our social world, and culture as a whole, they will never come close to capturing what matters. Even worse, they’ll often actively obscure it.
Today, I find that numbers have very little to offer when it comes to my daily work, my physical or mental fitness, my relationships, or any other part of my life I consider important. Granted, I’m lucky enough to be in relatively good health at the moment. I don’t have to track my glucose levels or monitor my blood pressure. As a freelance writer, I also have the luxury of not having numbers foisted on me in the form of key performance indicators (KPIs), objectives and key results (OKRs), or any of the endless quantitative evaluations that come baked into pretty much every corporate and gig economy job.
Still, in a very real sense, there is no escaping metrics or, especially, the logic that accompanies them. Knowing has become numeric, and we all live in a world that increasingly sees us as a collection of numbers—as “data subjects.” The first and most urgent challenge, I’d suggest, is finding a way to keep us from seeing ourselves and each other that way.
This won’t be easy. As Porter, Nguyen, and countless other philosophers, anthropologists, and historians have already observed, the language of numbers is largely how we ascribe value today—as well as how we digest and metabolize our relationships to ourselves, to others, and to the world around us. Indeed, many of us have accepted not only that metrics have a natural existence in human affairs but that there are in fact
aspects of human life that cannot be somehow translated into data.
Knowing has become numeric, and we all live in a world that increasingly sees us as a collection of numbers— as “data subjects.”
So how do we push back? Nguyen’s book offers a useful first step. As he notes again and again in
, believing that numbers say something real or useful about human needs and desires gives them power. We can, at the very least, start to seriously question that belief, to ask what meaning and pleasure we might be giving up in pursuit of a metric.
Doing so will hopefully lead to another realization: that playing the numbers game is ultimately a losing proposition for humans. If we insist on expressing our worth through attentional metrics and productivity scores, if we continue to turn intelligence and creativity into a series of benchmarks for AI to surpass, we’ve already lost. Of course machines will surpass us in a world built around metrics. That is literally what we create them to do. The answer is not to turn ourselves into machines too.
If there’s one thing that keeps me up at night, it is that we’ve become so accustomed to seeing and understanding the larger world and ourselves through numbers that it has deprived us of the language to express what’s fundamental and valuable about our own humanity. We need this ability now more than ever, especially if we’re going to adequately answer two of the most important questions of our era: What are humans for? And what is AI for?
As part of my own attempts to disentangle myself from a life of numbers—efforts that started shortly before covid—I’ve abandoned most of the tools of measurement I spent a decade collecting. I’ve largely given up on social media. I stopped using apps to track my health and well-­being. The watch I currently wear tells me the time and the date and nothing else.
In fact, the only holdover from my days of obsessive self-quantification is a dogmatic devotion to walking—without all the step counting, of course. These days, I walk when I’m feeling disillusioned or overwhelmed; I walk when I can’t figure out how to finish an essay; I also walk because I enjoy spending time outdoors with my dog and catching up on the details of my neighbors’ lives. The benefits of pursuing this daily activity are as clear and obvious to me as anything could be in life. I just can’t express them in a number.
Bryan Gardiner is a writer based in Oakland, California.
A story about saving
Many of the insights hitting soccer pitches today trace back to Jesse Davis and a team of computer scientists open-sourcing tools for some of the sport’s trickiest problems.
Public officials in one California burgh spent nearly $400,000 on tech to flush out waterfowl.
No part of the globe is free of human fingerprints. Should we deploy technology to change it back?
Illustration by Rose Wong
Discover special offers, top stories,
upcoming events, and more.",https://www.technologyreview.com/2026/06/19/1138778/inevitable-weakness-metrics-quantified-life-book-review/,MIT Technology Review,综合科技,无,2026-06-19T19:26:10+00:00
Brain-computer interface trials are taking off,2026-06-19,"EXECUTIVE SUMMARY
This week, I covered
the story of Casey Harrell
—a man with ALS who is “the first power user” of a brain implant, according to the researchers who worked with him. Harrell is paralyzed and unable to speak coherently without the device. He has now spent almost three years using a brain-computer interface (BCI) that enables him to “speak,” surf the web, and perform his job as a climate activist, largely independently.
Since Harrell was implanted with the device, in July 2023, a team at the University of California, Davis, has worked with him to adjust and improve its offerings. They’ve refined its accuracy, for example. And they’ve introduced settings including a privacy mode and a “profanity filter” that lets Harrell talk to his daughter without risking accidental swearing.
Harrell told me that, for him, the device is “nothing short of revolutionary!”
It has enabled him to maintain an income, reconnect with friends and family, and read to his daughter.
The team that developed his BCI is one of several working on ways to use technology to allow people with paralysis to communicate, engage with the online world, and regain some independence. And Harrell is one of a growing number of people volunteering their brains to, as he puts it, “pay it forward and do the scientific research … [and] get some personal benefit.”
Over the past couple of years, the number of BCI trial volunteers has soared. This year, China became the first country to approve a BCI for medical use. Advances in technology are allowing engineers to provide more features than ever. BCI research is properly taking off.
I should first point out that BCIs come in different forms
. Harrell’s device includes a set of electrodes embedded in his brain that pick up the electrical activity associated with speech. Those electrodes are connected to two docking ports on top of his head that can be plugged into a computer.
That computer is loaded with software trained to decode his brain signals into phonemes (units of sound in speech) and predict what Harrell wants to say. He can then use an eye gaze tracker to make any corrections before the speech is played out loud.
But some BCIs don’t need to be “plugged in”—they’re fully implanted and wireless. Others are less invasive; they might involve placing wired electrodes on the surface of the brain or simply wearing a cap of electrodes, for example. There are trade-offs—the closer you get to the neurons you want to record from, the better your signal will be. But generally speaking, the more invasive the surgery, the higher the risk of complications.
BCIs can also have different functions.
Harrell has ALS, but most BCIs in use today are sitting in the brains of people with spinal cord injuries. Typically, these individuals have some degree of paralysis; for example, they may be unable to move their arms and legs, but their face and ability to speak are unaffected. In those cases, BCIs can be used to control other kinds of devices that might help with mobility.
In 2024, Michelle Patrick-Krueger, then at the University of Houston, and her colleagues published
a roundup of all trials of BCIs conducted between 1998
, which is when they believe the first device was implanted, and the end of 2023. They identified 21 research groups that, among them, had trialed BCIs in a total of 67 volunteers.
“Since then, that number has increased a lot,” says Mariska Vansteensel, a BCI researcher at University Medical Center Utrecht. In January, Neuralink (the BCI company founded by trillionaire Elon Musk)
that it has implanted 21 people with its device in the past two years.
Synchron, another BCI company, is currently testing its devices in trials in North America and Australia. Shanghai-based Neuracle has been trialing a BCI since November 2024, and it
recently obtained approval
for the device to be used outside of clinical trials. Precision Neuroscience, cofounded by a former co-creator of rival Neuralink, is also trialing its BCI, which sits on the surface of the brain.
At the same time, academic research has continued. The UC Davis team that worked with Harrell is part of BrainGate—a BCI research effort that has been running for the past two decades. Other academic teams are exploring a variety of devices, from the fully implanted to the minimally invasive.
Since 2024, when Patrick-Krueger’s paper was published, the number of people who have been implanted with a brain electrode has more than doubled, according to Vansteensel.
“My current estimation would be around 150 people,” she says.
The technology is improving too. Take the BrainGate trial, for example. The first 17 years of that trial focused on the use of what researchers call “point-and-click” communication—allowing users to control a cursor and “click” with their brain activity. But in recent years the team has pivoted toward decoding speech, says David Brandman, the lead investigator on the team (and the person who implanted Harrell’s electrodes). Today, Harrell’s device uses a voice clone—the speech it produces is based on previous recordings of Harrell’s voice.
But BCIs are still experimental.
And plenty of questions remain about who might benefit from them—and how long the devices will last. So far, most BCIs have been implanted in people with spinal cord injuries. We know even less about how they might benefit other people who have ALS, for example. In some cases where the devices initially helped people with ALS—even someone who was completely locked in—the BCIs eventually stopped working. And scientists don’t really know why.
The only way they’ll find out is through more research—and the participation of volunteers like Harrell. So it’s exciting to see trials truly take off. And I promise I’ll update you on where they stand two years from now.
This article first appeared in The Checkup,
MIT Technology Review’s
weekly biotech newsletter. To receive it in your inbox every Thursday, and read articles like this first,
The country wants to become a global leader in brain implants. Strong government support is expected to help accelerate that process.
Researchers are decoding how signals move between body and brain, with implications for how we understand and treat conditions from obesity to anxiety.
In an early step towards artificial wombs, a biotech company claims it’s developed a “fully artificial” chicken egg.
Dozens of athletes on performance-enhancing drugs competed in the Enhanced Games. Organizers hope it'll sell a lot of peptides and other supplements.
Illustration by Rose Wong
Discover special offers, top stories,
upcoming events, and more.",https://www.technologyreview.com/2026/06/19/1139270/brain-computer-interface-trials-are-taking-off/,MIT Technology Review,综合科技,无,2026-06-19T19:26:12+00:00
