title,published_at,content,url,source_name,domain,sub_domain,crawled_at
Huawei’s FusionSolar9.0 solution aims to redefine optimal LCOE for utility-scale solar projects - pv magazine Global,2026-06-19,"Technology & Products
The company’s new FusionSolar9.0 solution boosts yield and reduces LCOE for the full lifecycle of large-scale power plants, according to Zhang Xingzhong, President of Utility, Commercial & Industrial Solar Business, Huawei Digital Power.
Technology & Products
Utility-scale
Image: Huawei Digital Power
Zhang: One of the major challenges is the return-on-investment, which needs to consider over the 20-year lifecycle, not only the initial CAPEX. The second challenge is how to ensure stable grid operation, given the massive amount of renewable energy that is now being connected to the grid.
Third is as the increased scale of power plants, since the conventional manual O&M can’t deal with the challenge and must turn to digital solutions to improve efficiency. The fourth challenge is ensuring long-term reliability and safety, which is always the foundation.
Zhang: LCOE considers factors like investment, yield, and O&M costs, etcetera. Firstly, Huawei leverages the innovation in electronics to minimize the Balance-of-System (BOS) of solar projects. Through breakthroughs in the new IGBT, the new thermal design, and the new generation of 506kW smart string inverter, the flagship product of FusionSolar9.0 solution realized a 40%+ increase in power density compared with the last generation, and pioneering the 1000 Vac application in solar PV system. The FusionSolar9.0 solution can decrease BOS by 0.3- 0.6 US cents per watt in an 11 MW array design, by contrast to the conventional solution of a 9 MW+ array with 300+ kW inverters.
FusionSolar9.0 also boosts energy yield with the 506kW inverter’s longer PV string design and a wider working range for MPPT voltage. This means it allows the system to start earlier and shut down later – another contributor to increased power yield. In projects in China, the 506kW inverter delivers ~1% higher yield versus conventional  solution.
Moreover, the 506kW inverter has equipped the fans with innovative self-cleaning and anti-icing technologies to adapt to diverse environments and weather conditions, which can reduce manual O&M and prevent energy losses. All the features above can bring considerable economic benefits.
Zhang: To achieve higher power and voltage while maintaining high reliability, it depends on Huawei’s sustained investment in and breakthroughs in fundamental technologies, mainly in three perspectives.
First, the new-generation IGBT module boosts voltage withstand capacity by 25%, reduces power loss by 10%, and increases maximum junction temperature by 20%. Second, the innovative Smart Hybrid Cooling System enhances heat dissipation capability by 30% without compromising the overall size and dimensions. Third, it is because the new production line has all the key processes 100% automated and empowered by AI inspection in all manufacturing procedures, which guarantees the strong production capacity with excellent quality.
Zhang: I can summarize these into five capabilities. Firstly, the Smart Internal Potential Construction Algorithm can cope with transient voltage instability by generating reactive power within 10 ms, while it takes around 30 ms for the conventional grid-following inverters.
Secondly, the 0-20 s Smart Virtual Inertia can support frequency stability. Thirdly, it can enhance short-circuit-ratio (SCR) of the PV plant, which brings in stronger renewable energy transmission capability, as the two factors have a positive correlation. Fourthly, the grid-forming inverter can realize auto-recovery of reactive power at nighttime after the power failure is recovered, which can avoid fines in some countries. Lastly, it can provide off-grid power supply during the commissioning phase of a solar farm and use self-generated PV power for equipment commissioning and testing due to its voltage-source characteristic, which is more cost-saving, environment friendly, and socially beneficial, and enables faster grid-connection compared with a diesel generator solution.
The questions and responses in this sponsored interview article were provided by Huawei Digital Power.
View author posts",https://www.pv-magazine.com/2026/06/19/huaweis-fusionsolar9-0-solution-aims-to-redefine-optimal-lcoe-for-utility-scale-solar-projects/,pv magazine,综合新能源,光伏、氢能、储能,2026-06-19T19:21:57+00:00
China wafer output set to rise despite weak demand and inventory pressure - pv magazine Global,2026-06-19,"Markets & Policy
In a new weekly update for
, OPIS, a Dow Jones company, provides a quick look at the main price trends in the global PV industry.
Markets & Policy
Image: pv magazine
Free-On-Board (FOB) China M10, 210R, and G12 wafer prices remained stable at $0.138/pc, $0.147/pc, and $0.169/pc, respectively, unchanged from the previous week, according to the OPIS Global Solar Markets Report released on June 13.
Wafer market fundamentals continue to mirror those of the polysilicon sector, with bearish sentiment, weak demand, and ongoing inventory accumulation remaining the dominant themes, according to market participants. Based on manufacturers’ production schedules, industry sources estimate wafer output reached nearly 50 GW in May and could increase further to approximately 55 GW in June.
A market participant noted that the increase in production is primarily being driven by vertically integrated manufacturers and major specialized wafer producers. Leading first-tier wafer makers are generally maintaining utilization rates below 50%, while financially weaker specialized manufacturers are operating at extremely low levels. Market reports have also emerged suggesting that some producers have begun selling portions of their ingot-pulling equipment as part of efforts to address financial pressures.
On the export front, industry participants said demand has softened in recent months because significant volumes of wafers were shipped to bonded warehouses in India, Southeast Asia, and Africa ahead of China’s export tax rebate cancellation, which took effect on April 1. These earlier shipments have reduced the urgency for immediate procurement. Nevertheless, a leading wafer manufacturer expects demand from overseas markets to improve in the second half of the year, particularly as domestic cell manufacturing capacity in India ramps up.
Overseas manufacturing expansion has not been smooth across all regions, however. A manufacturer that had previously announced wafer manufacturing plans in the Middle East is reportedly facing challenges and delays in advancing the project due to financing and partnership-related issues.
Still, improving geopolitical conditions in the Middle East are beginning to support expectations for smoother logistics and project execution elsewhere in the region. One market source highlighted a Middle Eastern solar cell manufacturing project that began initial production earlier this year.
The facility reportedly operated at low utilization during the first half of 2026 due to production ramp-up challenges and geopolitical conflict. However, following an easing of tensions, the project is now targeting a much higher operating rate by the third quarter.
Suppliers supporting the project have already received corresponding orders and have begun arranging shipments, the source said. As the facility gradually matures and expands production, it is beginning to establish a new trade flow for internationally traded wafers, potentially creating additional demand channels outside traditional markets, the source added.
pv magazine Webinar+
This pv magazine Webinar+ will provide a detailed market analysis of how geopolitical developments are creating regional pricing disparities across the photovoltaic value chain, from polysilicon to modules and critical materials such as soda ash, EVA, and POE.
More information
OPIS, a Dow Jones company, provides energy prices, news, data, and analysis on gasoline, diesel, jet fuel, LPG/NGL, coal, metals, and chemicals, as well as renewable fuels and environmental commodities. It acquired pricing data assets from Singapore Solar Exchange in 2022 and now publishes the
OPIS APAC Solar Weekly Report
The views and opinions expressed in this article are the author’s own, and do not necessarily reflect those held by",https://www.pv-magazine.com/2026/06/19/china-wafer-output-set-to-rise-despite-weak-demand-and-inventory-pressure/,pv magazine,综合新能源,光伏、氢能、储能,2026-06-19T19:21:59+00:00
Fraunhofer IWU storage analyzer reduces peak loads in factories - pv magazine Global,2026-06-19,"Technology & Products
The Fraunhofer Institute for Machine Tools and Forming Technology IWU says its energy storage systems in production (ESiP) analyzer can enable the use of close to half of electricity generated on-site.
Patrick Jowett
Technology & Products
Energy Storage
Fraunhofer IWU’s ESiP analyzer interface integrated into an AI-generated image | Image: Fraunhofer IWU
Fraunhofer Institute for Machine Tools and Forming Technology IWU
(Fraunhofer IWU) has unveiled a tool designed to support energy management in manufacturing companies has successfully proven itself in real-world applications with utilities and industrial companies.
The energy storage systems in production (ESiP) analyzer helps factories improve the integration of renewable energy and the reduction of peak loads.
A statement published by Fraunhofer IWU explains that it enables evaluation of various use cases, covering energy storage technologies from the machine level to the factory level, and supports companies in planning, integrating, and operating customized energy storage solutions.
The tool features specific design methodologies for different application scenarios, with operational factors such as system efficiency and specific production parameters incorporated into the simulations.
Fraunhofer IWU says the goal of the ESiP analyzer is “not only to support companies in selecting the appropriate storage technology, but also in developing optimal operating strategies for long-term, efficient and cost-effective use.”
“Experience to date shows that targeted simulations and optimized operating strategies can, in some scenarios, enable the use of close to half of the electricity generated on-site,” the researchers explained. “Grid stability also benefits from the smoothed consumption resulting from the use of storage systems.”
The research team adds that the ESiP analyzer functions even when planning information is partially incomplete, explaining that missing values in load profiles or yield data can be supplemented through appropriate scaling and simulations. They added that the analyzer can also offer additional perspectives through the combination of different applications, such as participation in energy markets and emergency power supply.
Fraunhofer IWU says it will present the current state of its analyzer at this year’s Smarter E Europe trade fair, as well as providing an outlook on a pilot plant, currently under construction in the German city of Chemnitz, that will be capable of of automatically disassembling traction batteries down to the cell level.
The pilot, expected to begin operations in August, will use artificial intelligence and analysis models to assess the health of batteries and identify both functional components and suitable use pathways.
Patrick Jowett
View author posts",https://www.pv-magazine.com/2026/06/19/fraunhofer-iwu-storage-analyzer-reduces-peak-loads-in-factories/,pv magazine,综合新能源,光伏、氢能、储能,2026-06-19T19:22:01+00:00
JinkoSolar achieves 34.82% efficiency for perovskite-silicon tandem solar cell - pv magazine Global,2026-06-19,"Research & Development
The result was validated by China’s Shanghai Institute of Microsystem and Information Technology of the Chinese Academy of Sciences.
Emiliano Bellini
Research & Development
A perovskite-silicon tandem solar cell displayed by JinkoSolar at SNEC 2026 | Image: pv magazine
Chinese PV module manufacturer
announced it achieved a power conversion efficiency of 34.82% for a perovskite-silicon tandem solar cell.
The company said the results have been certified by China’s Shanghai Institute of Microsystem and Information Technology of the Chinese Academy of Sciences. In its previous attempts, JinkoSolar achieved a cell efficiency of
34.76% for the same device configuration
“This efficiency breakthrough is attributed to JinkoSolar’s innovations in multiple core technologies, including the dual-layer composite passivation contact structure for N-type TOPCon cells, multidimensional interface passivation technology, gradient crystallization kinetics control strategies, and enhanced optical coupling and light management technologies,” the company said in a statement. “This milestone marks a critical step forward in the industrialization of next-generation perovskite tandem technology.”
No more technical details on the cell improvement were disclosed.
Chinese manufacturer Longi holds the world record for perovskite-tandem solar cell efficiency,
achieving 34.85% efficiency in April 2025
. This cell device was developed in partnership with China’s
Soochow University
and was described in the paper “
Efficient perovskite/silicon tandem with asymmetric self-assembly molecule
,” which was recently published in
Emiliano Bellini
View author posts",https://www.pv-magazine.com/2026/06/19/jinkosolar-achieves-34-82-efficiency-for-perovskite-silicon-tandem-solar-cell/,pv magazine,综合新能源,光伏、氢能、储能,2026-06-19T19:22:02+00:00
"The Hydrogen Stream: 2030 targets increasingly out of reach, says IEA - pv magazine Global",2026-06-19,"Markets & Policy
A new IEA report shows that demand for hydrogen worldwide surpassed 100 million tonnes in 2025, while production of low-emissions hydrogen grew by 20% to almost 1 million tonnes.
Sergio Matalucci
Markets & Policy
Energy Storage
Utility-scale
RCT Hydrogen’s 5MW electrolysis stacks | Image: RCT Hydrogen
The latest edition of the
International Energy Agency
(IEA) Global Hydrogen Review finds that the conflict in the Middle East is renewing interest in hydrogen and hydrogen-based fuels as long-term options to strengthen energy security. However, it stresses that low-emissions hydrogen remains far from the scale needed to deliver an immediate response. The report also notes that the war has disrupted global production and trade in hydrogen-based products. The IEA reports that global hydrogen demand surpassed 100 million tonnes in 2025, while production of low-emissions hydrogen rose 20% year on year to almost 1 million tonnes. However, it warns that persistent barriers — including high costs, uncertain demand, complex regulation and a lack of infrastructure — continue to slow deployment, putting 2030 targets set by governments increasingly out of reach, according to IEA Executive Director Fatih Birol.
have launched a call for proposals to support domestic development of an industrial-scale electrolyzer, with backing from the federal government. The initiative aims to reduce costs and integrate innovative technology compared with imported systems, Petrobras said. The call requires at least 50% local content and will provide BRL 150 million ($30 million) in non-reimbursable funding, split equally between Finep and Petrobras. At least three companies are expected to participate in the development. “We want to reduce our dependence on foreign technology and, thereby, lower the cost of hydrogen, which is the main barrier to large-scale adoption,” said Petrobras Director of Engineering, Technology and Innovation Renata Baruzzi. The project scope covers basic engineering through to a pre-commercial prototype.
and its partners have taken a final investment decision (FID) on the Luxembourg Hydrogen Valley (LuxHyVal) project. The 5 MW electrolyzer will produce renewable hydrogen for mobility and industrial use in Luxembourg, the company said.
California-based
Ohmium International
has signed a cooperation agreement with Polish green hydrogen and ammonia project developer Hynfra for projects in Mauritania, Jordan and Oman. The agreement covers the front-end engineering and design (FEED) phase and establishes a framework for ongoing collaboration. Ohmium will also provide technical support and PEM electrolyzer expertise throughout development. The hydrogen produced is intended for local markets and Europe.
has signed an agreement with
Energie Steiermark
for long-term green hydrogen supply to its production site in St. Martin im Sulmtal, Austria. Under the deal, Energie Steiermark will develop and operate a PEM electrolyzer with capacity of up to 750 tonnes of green hydrogen per year.
is developing an autonomous zero-direct-emissions alternative to helicopters, capable of inspecting up to 350 km of infrastructure per mission, including power lines, pipelines and rail networks. The company is showcasing its hydrogen-powered airship at Paris Expo Porte de Versailles through tomorrow.
Sergio Matalucci
View author posts",https://www.pv-magazine.com/2026/06/19/the-hydrogen-stream-2030-targets-increasingly-out-of-reach-says-iea/,pv magazine,综合新能源,光伏、氢能、储能,2026-06-19T19:22:04+00:00
Sabic unveils laser-weldable resins for solar microinverters - pv magazine Global,2026-06-19,"Technology & Products
Manufactured in New York, the materials aim to speed up component assembly and reduce costs by enabling laser welding for housing enclosures.
Ryan Kennedy
Technology & Products
Laser weld. | Image: Wikimedia Commons / LaserTherm
U.S. chemical company SABIC has introduced NORYL V0150TW and V0150IR2, two thermoplastics designed to replace metal and traditional polymers in photovoltaic components like microinverters, solar tracker boxes, and junction boxes.
The NORYL V0150TW (absorptive) and V0150IR2 (transmissive) resins are formulated to allow manufacturers to shift from ultrasonic welding or adhesive bonding to laser welding. This shift eliminates curing-dependent bonding materials to reduce production cycle times and lower overall assembly costs.
Compared to metal, these materials reduce component part size by up to 40%, cut weight by up to 35%, and lower overall material usage by up to 30%. The resins feature a thin-wall flame retardancy rating of UL94 V0 5VA at 1.5 mm, maintain mechanical integrity in operating temperatures up to 150°C, and provide up to 15 years of outdoor service life.
The new NORYL grades are backed by the company’s global supply network, which relies on key polyphenylene ether (PPE) resin manufacturing and compounding hubs in Selkirk, New York, and Bergen op Zoom, Netherlands.
Now globally available, these materials recently earned a Silver 2026 Edison Award for innovation.
Ryan Kennedy
View author posts",https://www.pv-magazine.com/2026/06/19/sabic-unveils-laser-weldable-resins-for-solar-microinverters/,pv magazine,综合新能源,光伏、氢能、储能,2026-06-19T19:22:06+00:00
US firm's floating data centers to meet power demand using wave energy,2026-06-19,"High-performance computing is moving into international waters to solve the dual challenges of energy availability and hardware cooling. US-based tech startup Panthalassa recently finalized a $140 million Series B investment round to scale production on its self-propelled maritime data platforms.
“There are three sources of energy on the planet with tens of terawatts of new capacity potential: solar, nuclear, and the open ocean,” said Garth Sheldon-Coulson, Co-Founder and CEO of Panthalassa.
This capital injection will fund the completion of an assembly facility near Portland, Oregon, and accelerate a pilot deployment in the northern Pacific Ocean later this year.
“As demand for new electricity and computing continues to surge, terrestrial data centers face mounting constraints: limited grid capacity, cooling water scarcity, supply chain bottlenecks, permitting delays, and impacts on local communities and infrastructure,” said the company in a press release.
Residential communities frequently organize against new data center construction out of concern over increased utility costs, noise pollution, and the diversion of public resources.
Panthalassa evades these regional regulatory and environmental obstacles by deploying autonomous computing nodes directly into deep water.
“Panthalassa’s nodes are autonomous, floating energy systems that are mass-produced from plate steel in coastal factories,” added the press release. “They operate in the distant ocean, where they generate clean electricity around the clock.”
Onboard mechanical systems convert the kinetic movement of waves into a steady supply of electricity, establishing a continuous power source that functions independently of weather-dependent
terrestrial renewables
The entire data processing cycle occurs directly on the water. Instead of using undersea cables to send raw electricity back to coastlines, the platforms consume the power immediately to run onboard artificial intelligence hardware.
The surrounding ocean operates as a perpetual thermal sink, providing natural cooling that maintains optimal chip temperatures and slows hardware degradation without consuming municipal freshwater.
For data transmission, the system relies on low-Earth-orbit satellite networks to receive incoming commands and broadcast completed AI inference tokens back to terrestrial clients.
“Rather than transmitting energy back to terrestrial grids, Panthalassa uses it directly onboard to power
, sending inference tokens to land by satellite,” explained the company.
The upcoming deployment of the Ocean-3 pilot series represents the culmination of a ten-year development timeline. Panthalassa previously conducted oceanic field tests using its Ocean-1, Ocean-2, and Wavehopper designs in 2021 and 2024 to verify the stability of its power generation and navigational software.
The scheduled Pacific trials will focus on processing active computing workloads and standardizing manufacturing protocols in preparation for widespread commercial availability in 2027.
Financial backers and corporate partners indicate that moving high-density computing to the ocean offers a viable template for scaling global technology infrastructure while mitigating the economic and ecological impact on civilian communities.
“We’ve built a technology platform that operates in the planet’s most energy-dense wave regions, far from shore, and turns that resource into reliable clean power,”
Sheldon-Coulson. “We’re now ready to build factories, deploy fleets, and provide a sustainable new source of energy for humanity.”
Get the latest in engineering, tech, space & science - delivered daily to your inbox.
An active and versatile journalist and news editor. He has covered regular and breaking news for several leading publications and news media, including The Hindu, Economic Times, Tomorrow Makers, and many more. Aman holds expertise in politics, travel, and tech news, especially in AI, advanced algorithms, and blockchain, with a strong curiosity about all things that fall under science and tech.
Israeli firms' tube-launched interceptor drone can offer aerial protection for ground platforms
US greenlights floating wind that could slash turbine installation time by 50%
America's most advanced metal 3D printer uses 12 lasers to mass-produce rocket frames
Bill Gates' nuclear firm begins design assessment process in UK for 345 MW Natrium reactor
US Navy backs 3,800 mph-speeding Blackbeard hypersonic missile with first contract
More from Energy
US-backed Ward 250 nuclear reactor achieves criticality under DOE program in Utah
Germany launches multimillion-dollar nuclear fusion hub to study matter found inside stars
Waste oils and fats to be turned into low-emission jet fuel with new modular tech
Advanced nuclear project secures 77-acre US site for molten salt reactor testing
New EV battery system uses internal signals to detect cell damage in real time
US-backed Ward 250 nuclear reactor achieves criticality under DOE program in Utah
Germany launches multimillion-dollar nuclear fusion hub to study matter found inside stars
Waste oils and fats to be turned into low-emission jet fuel with new modular tech
Advanced nuclear project secures 77-acre US site for molten salt reactor testing
New EV battery system uses internal signals to detect cell damage in real time",https://interestingengineering.com/energy/us-firm-deploys-floating-data-centers-that-generate-electricity-using-ocean-waves,interesting engineering,综合科技,无,2026-06-19T19:22:11+00:00
