title,published_at,content,url,source_name,domain,sub_domain,crawled_at
GM advances LMR battery cells as LFP plans fade - electrive.com,2026-06-12,"General Motors is reassessing its battery strategy for future electric vehicles. According to Kurt Kelty, the company’s head of battery development, GM is reconsidering earlier plans to introduce LFP cells and may instead focus on lithium manganese-rich (LMR) battery technology.
An LMR cell in prismatic format.
Image: Steve Fecht für General Motors
General Motors continues to adjust its battery strategy. The US carmaker initially focused on nickel-based NMCA (nickel-cobalt-manganese-aluminium) cells before announcing plans to convert its cell plant in Spring Hill to produce LFP (lithium iron phosphate) batteries as lower-cost cell technologies gained traction. The company
now appears to be preparing another strategic shift.
According to
, GM’s battery chief Kurt Kelty revealed that the manufacturer plans to focus on developing lithium-manganese-rich (LMR) battery chemistry instead of LFP. This technology is expected to cost about the same as LFP cells but offer higher energy storage capacity for the same weight and volume.
Despite the latest shift in strategy, the Spring Hill plant in Tennessee will begin producing LFP cells this month, Kurt Kelty confirmed. However,
reports that these cells are intended for stationary energy storage systems rather than electric vehicles. Ultium Cells, the battery joint venture between General Motors and LG Energy Solution, had already announced in March that it would redirect
part of its battery cell production in Tennessee from EV applications to stationary energy storage systems
“There is a possibility where LFP does not ​earn its way into our portfolio,” Kelty told
. He also described LMR as GM’s ‘workhorse’ technology. “That’s where we’re going to be using the big volume.” According to the news agency, GM has been developing LMR cells for over a decade.
Ford, too, sees significant potential in this technology
LMR cell chemistry is a further development of conventional lithium-ion batteries that uses a cathode with a high manganese content. Because manganese is significantly less expensive than cobalt, the technology has the potential to reduce battery costs. At the same time, LMR cells are expected to deliver around 33 per cent higher energy density than LFP batteries at a comparable cost level. However, the technology still faces several challenges, including limited durability, high capacity loss and restricted fast-charging performance.
General Motors is collaborating primarily with LG Energy Solution on LMR development. Last year, the partners announced they were working on a new generation of prismatic LMR battery cells,
which are expected to be market-ready by 2028
. According to earlier reports, these prismatic LMR cells are intended primarily for GM’s electric pickups and large SUVs.
One aspect remains unchanged: the partnership between GM and LG Energy Solution is based on years of joint research. The two companies have been working on manganese-rich lithium-ion cell chemistry since 2015. According to LG Energy Solution, the company held more than 200 patents related to LMR technology as of May 2025, making it the largest holder of intellectual property in this field worldwide.
Beyond the technological benefits, GM has also highlighted the strategic significance of LMR chemistry for the North American battery industry. According to the company, future LMR cell production could rely on domestic supplies of lithium, graphite and manganese.
Most of the electric vehicles GM has brought to market so far are equipped with nickel-rich batteries. An exception is the recently introduced Chevrolet Bolt, which, as the most affordable electric vehicle in the lineup, features LFP cells from the Chinese battery manufacturer CATL.
about „GM advances LMR battery cells as LFP plans fade“",https://www.electrive.com/2026/06/12/gm-advances-lmr-battery-cells-as-lfp-plans-fade/,electrive,电池,电气化交通工具,2026-06-12T21:06:26+00:00
IAV and Nexperia target higher EV battery efficiency - electrive.com,2026-06-12,"Development service provider IAV and semiconductor manufacturer Nexperia are collaborating on a new generation of high-voltage architectures for electric vehicles under the 'ONE Inverter' project. The partners aim to increase the amount of power that can be extracted from each battery cell, rather than focusing solely on larger battery capacities.
Image: Nexperia
Until now, the performance of a traction battery has often been determined by its weakest cell. If a single cell underperforms, it can limit the performance of the entire battery system. IAV and Nexperia have therefore developed a software-controlled architecture that manages each battery cell individually. Rather than treating the battery as a single unit, the system dynamically controls individual cells, enabling each one to deliver the level of performance it can currently provide.
This dynamic control is made possible by Nexperia’s specialised wide-bandgap semiconductor technologies, particularly a bidirectional gallium nitride (GaN) device. This technology enables efficient and rapid switching at the battery cell level, making the approach both technically and economically viable. According to the two partners, other semiconductor solutions would significantly increase system complexity and costs. Additionally, further components from Nexperia’s semiconductor portfolio, including bipolar devices, support the overall system design.
“IAV’s strength lies in translating technological innovation into system-level solutions for our customers. Together with Nexperia, we are exploring how software-defined battery architectures can unlock new levels of efficiency, flexibility and resilience for future software-defined vehicles,” said Jörg Astalosch, CEO IAV.
“Strong partnerships are key to driving innovation in next-generation vehicle architectures. By combining our wide bandgap semiconductor expertise – spanning both SiC and GaN – with the advanced system concepts of our partner IAV, we are enabling new approaches to e-mobility design from the ground up. Close collaboration at an early stage allows us to align semiconductor and system requirements and translate innovative ideas into scalable, high-performance solutions,” said Edoardo Merli, SVP and Head of Business Group Wide Bandgap, IGBT & Modules (WIM), Nexperia.
about „IAV and Nexperia target higher EV battery efficiency“",https://www.electrive.com/2026/06/12/iav-and-nexperia-target-higher-ev-battery-efficiency/,electrive,电池,电气化交通工具,2026-06-12T21:06:28+00:00
Dodge showcases muscle car with solid-state battery - electrive.com,2026-06-12,"Stellantis has integrated solid-state battery cells from its partner Factorial Energy into a development vehicle and has now launched a road-testing programme. The move follows the initial validation of the cells by Stellantis last year.
Image: Stellantis
Stellantis has equipped a Dodge Charger Daytona development vehicle with a solid-state battery and will now use the technology demonstrator for real-world road testing. The programme is intended to assess the performance, safety and reliability of Factorial’s battery cells. According to the partners, this marks ‘the first integration of solid-state cells into a Stellantis vehicle.’
The partners are focusing their testing on Factorial’s FEST (Factorial Electrolyte System Technology), which combines a lithium-metal anode with a polymer separator Factorial began distributing B-samples of the solid-state cells, which offer a capacity of more than 106 Ah,
in June 2024
. In 2025, Stellantis and Factorial demonstrated fast charging with FEST cells featuring an energy density of 375 Wh/kg, charging from 15 to 90 per cent SoC in 18 minutes. Stellantis also
validated these FEST cells last year
Factorial Energy is a US-based developer of solid-state battery cells backed primarily by Stellantis, Mercedes-Benz and Hyundai-Kia. Alongside its FEST technology, the company is pursuing further development programmes. One example is its collaboration with Mercedes-Benz on solid-state cells marketed under the Solstice name. These cells are currently at the A-sample stage and are designed to offer higher energy density while using a dry cathode coating process.
In September 2024, Factorial stated that its Solstice cells could achieve an
energy density of up to 450 Wh/kg
, although it remains unclear whether this figure refers to the cell or pack level. According to the company, this could increase the range of electric vehicles by up to 80 per cent. Factorial had previously also
reported progress
in reaching a cell capacity of 40 Ah for the Solstice technology.
As part of the road-testing programme with Stellantis, the carmaker says the transition from cell validation to integration in a development vehicle required the combined expertise of engineers from both companies. Stellantis developed a ‘patented new mechanical architecture’ to integrate the FEST cells into the existing battery pack. At the same time, the teams adapted the control systems and pack design ‘to bring out the best of solid-state cell performance.’ According to the partners, these technical modifications are essential to ensure cell performance under all conditions.
The Dodge Charger Daytona, with its integrated cells, will take centre stage in the upcoming calibration and test-drive programme. The model is
an all-electric muscle car from Stellantis’ US brand Dodge
, built on the
STLA Large platform
. Shortly after the electric vehicle’s market launch in late summer 2024, Stellantis announced its intention to collaborate with Factorial on a demonstration programme to integrate solid-state cells into the Dodge Charger Daytona.
Nearly two years later, the programme is now set to begin
“Battery development is a balancing act. It’s not enough to optimise a single metric. We need a system that delivers real benefits in a real vehicle,” said Ned Curic, Stellantis Chief Engineering and Technology Officer. The goal is to bring solid-state batteries closer to customers—’with the potential for longer range, faster charging and lower costs.’ Equally important, however, is the strong compatibility of FEST with existing lithium-ion manufacturing processes.
“We are deeply honoured to work alongside Stellantis, one of the world’s great mass-market automakers, on this STLA Large-based development car,” said Siyu Huang, CEO of Factorial. “What we have built together, from cell chemistry to pack architecture to enable real-world road testing, is exactly the kind of deep, full-stack collaboration that solid-state has always required”
about „Dodge showcases muscle car with solid-state battery“",https://www.electrive.com/2026/06/12/dodge-showcases-muscle-car-with-solid-state-battery/,electrive,电池,电气化交通工具,2026-06-12T21:06:30+00:00
Global Supply Chain Awards 2026: Company of the Year,2026-06-12,"Global Supply Chain Awards 2026: Company of the Year
Prioritise Us
The Company of the Year Award, a coveted honour at The Global Supply Chain Awards, is now open for entry, providing opportunities for celebration
Entries for the Company of the Year award are now open. The Global Supply Chain Awards 2026 are looking for organisations that have excelled in the past 12 months in the supply chain sector.
During times of turbulence, the companies in our industry that shine are the ones that demonstrate adaptability to market challenges. With
global disruption
at the forefront of everyone’s minds, it is imperative that we look to celebrate the organisations capitalising on opportunities as they arise.
This award is open to small to mid-sized organisations with fewer than 1,000 employees, displaying growth and ambition with regard to their operations.
Our awards ceremony, which takes place in September, presents the perfect chance for companies to reflect on the previous 12 months and take stock of their wins and achievements.
This celebration brings together some of the most influential supply chain executives all in one room, as we sit down for an exclusive black-tie gala dinner and discuss the key initiatives that have driven their company’s supply chain success in recent times.
Taking place at the iconic JW Marriott Grosvenor House London, the Global Supply Chain Awards, we will be honouring those corporate milestones of your company as a whole, focusing on companies that have been able to display measurable impact, sustainability and growth in today’s competitive global market.
While it is important to focus on the future of our function, the relentless pursuit of excellence often allows companies little time to reflect on the success along the way.
This accolade gives us the time to stop, pause and take note of key initiatives driving your company’s success, how you’ve
demonstrated agility
during difficult global market conditions and how you as an organisation live and breathe the best practices responsible for seamless execution.
When considering the application for this category, judges will be considering the following factors:
If you and your company measure up to these criteria and have a story to tell about your progress, we would love to hear from you.
winners of the Company of the Year Award
, Viettel Post Joint Stock Corporation, were noted for their dedication to sustainability and social responsibility. Judges were particularly impressed by innovations such as electrifying vehicles and building energy-efficient hubs to advancing circular practices and delivering disaster relief, which demonstrated the firm’s commitment to environmental stewardship and social well-being while shaping its sustainable logistics future.
The efforts of this firm to
contribute towards a more sustainable future
for our sector show just how important this category is. It is important we reward these achievements, as we look to inspire the use of innovation to further our processes.
Here are the dates and deadlines you will need to know if you would like to submit an entry for the Company of the Year award:
Competition in this category is expected to be strong. Our judging panel are looking forward to learning more about the businesses that have shown remarkable agility, innovation, and performance within their supply chain operations.
Co-located with
Sustainability LIVE
Procurement LIVE
, Supply Chain LIVE takes place on 8 and 9 September at QEII Centre, Westminster.",https://supplychaindigital.com/news/global-supply-chain-awards-2026-company-of-the-year,Supply Chain Digital,综合媒体,关键原材料/矿产,2026-06-12T21:07:37+00:00
Global Supply Chain Awards: The Supply Chain Hero Award,2026-06-12,"Global Supply Chain Awards: The Supply Chain Hero Award
Prioritise Us
Entries for The Supply Chain Hero Award are now open, recognising those excelling in their role, fostering innovation and driving operational excellence
The coveted Supply Chain Hero Award is now open for entries to those individuals who go above and beyond within their role in the supply chain sector.
It is a crucial moment for supply chain function, as it faces external cross-border pressures like never before. Meanwhile, the push to innovate has never been greater.
This honour at the
Global Supply Chain Awards
will be closely watched by many, as our function thrives due to the individuals who push it forward, while simultaneously driving their organisations into a new era of logistics.
As well as celebrating the successful organisations in the industry, it is important to acknowledge the individuals driving success. These are the people behind the operations, those who are ensuring efficiency and making the decisions which result in resilient and sustainable supply chains.
Our judging panel is excited to welcome award entries from the individuals who are demonstrating the
leadership qualities
that are required to navigate supply chain functions. It is imperative to have passionate logistics professionals who can lead from the front.
It is the dedication and the hard work of some of the most talented employees that will earn candidates a spot on our shortlist. We want to celebrate the actions of the people who have made a notable positive impact on their organisation’s supply chain success.
The unsung heroes of the sector are more than deserving of praise. Those who have shown strategic and operational excellence will be among the attendees sitting down to enjoy an exclusive black-tie dinner on 8 September 2026 at the iconic JW Marriott Grosvenor House London.
Highlighting the people responsible for industry-wide initiatives, who champion collaboration, innovation and inclusion across global supply chains, will also work to inspire the next generation of talent.
Those nominated will be recognised for their unflinching adaptability to
navigate sudden disruptions
, proactive communication to spot bottlenecks early and deep analytical grit to balance cost, capacity and the end customer's needs simultaneously.
The judges assessing entries to this award will be using the following criteria:
If you or a team member fit the brief, we want to hear from you.
You may already know that your colleague displays exceptional commitment, leadership and problem-solving skills every day, but the rest of our industry would love to hear it too.
Shining a light at an individual level allows the human element to shine through and achievements of talent to celebrated.
Previous function executives who have been honoured at our awards have been commended for the way they influence policy, advance ESG practices and empower other professionals. We will also be celebrating emerging talent with our
Future Leader Award
on the night.
Wanting to nominate a supply chain superstar? You are running out of time. Here is the timeline to take note of:
Supply Chain LIVE
is co-located with
Sustainability LIVE
Procurement LIVE
, which takes place on 8 and 9 September at QEII Centre, Westminster.
Now is the time to nominate the hardworking colleagues responsible for success who deserve to be known as a supply chain hero.",https://supplychaindigital.com/news/global-supply-chain-awards-the-supply-chain-hero-award,Supply Chain Digital,综合媒体,关键原材料/矿产,2026-06-12T21:07:40+00:00
