title,published_at,content,url,source_name,domain,sub_domain,crawled_at
The Strange “Spacetime Crystal” That Can Suddenly Turn Into a Black Hole,2026-06-12,"A new mathematical breakthrough sheds light on how tiny black holes could emerge from critical states of spacetime.
Black holes are often portrayed as cosmic giants, swallowing stars and shaping entire galaxies. But some of the most intriguing black holes predicted by physics could be far smaller than an
. For decades, scientists have known that Einstein’s theory of relativity allows these microscopic black holes to form under extraordinary conditions. The problem was proving exactly how it happens.
Now, researchers from Goethe University Frankfurt and TU Wien have achieved a major breakthrough. Using an unusual mathematical approach, they have derived the first exact formula describing a process known as critical collapse, a phenomenon that sits at the boundary between ordinary spacetime and
The result provides a long-sought analytical explanation for behavior that had previously been seen only in computer simulations.
In everyday life, systems can sometimes reach a critical point where an almost imperceptible change triggers a dramatic transformation. Water freezing into ice is a familiar example.
“Sometimes a tiny, seemingly insignificant cause is enough to trigger a huge and dramatic change,” says Prof. Daniel Grumiller from TU Wien. “Take liquid water at zero degrees
), for example. A very small change is enough to make the water freeze. The water molecules then spontaneously arrange themselves into a regular pattern and form an ice crystal.”
Physicists believe spacetime can undergo a comparable transition.
According to Einstein’s theory of relativity, matter and energy shape the geometry of spacetime. Massive objects such as stars create strong distortions, while smaller objects produce weaker effects. Under very specific conditions, however, these distortions can organize themselves into an unexpectedly ordered structure.
Instead of remaining chaotic, spacetime develops a repeating pattern that researchers describe as a “spacetime crystal.”
“We say that spacetime is curved by mass,” explains Christian Ecker from the Institute for Theoretical Physics at Goethe University Frankfurt. “Large objects such as stars curve spacetime strongly — for example, we can observe this when light rays are deflected by massive stars. But smaller masses also produce spacetime curvature, just to a lesser extent.”
A spacetime crystal occupies an unusual position in physics. It represents a delicate balancing point between two completely different outcomes.
“This spacetime crystal is a very peculiar and fascinating object,” says Grumiller. “It is a kind of intermediate state, an unstable point that can evolve in two different directions. It may simply dissolve again, leaving behind ordinary spacetime filled with freely moving particles. But if a tiny amount of energy is added, the evolution takes a completely different path: the inconspicuous spacetime crystal turns into a black hole.”
Physicists call this threshold behavior critical collapse. It marks the exact boundary between a system that disperses harmlessly and one that collapses into a black hole.
The existence of critical collapse first gained attention in 1993, when computer simulations revealed a surprising pattern. No matter how the system was set up, black hole formation seemed to follow precise mathematical rules near the critical threshold.
The discovery hinted that a deeper theory was hiding beneath the simulations. Yet despite decades of effort, researchers could not derive an exact mathematical description.
That challenge has now been overcome.
The breakthrough came from looking at the problem in a way that initially seems counterintuitive: increasing the number of dimensions.
“Our universe has four dimensions — three dimensions of space and one dimension of time,” explains Christian Ecker. “But in principle, nothing prevents us from writing down physical equations for a larger number of dimensions — five dimensions, forty-two dimensions, or even infinitely many.”
While adding dimensions sounds like it would make the mathematics impossibly complicated, the opposite can happen. Certain features of gravity become much simpler when physicists examine them in the limit of infinitely many dimensions.
The next challenge is translating those insights back into realistic models of our universe. If successful, the approach could become a powerful new tool for studying some of the most difficult problems in gravitational physics.
“Our technique turns out to be remarkably stable. Depending on the desired precision, we can systematically improve our formulas using additional approximation methods,” says Florian Ecker from TU Wien. “This gives us a new method for studying black-hole-related phenomena that could previously not be analyzed analytically.”
Reference: “Analytic Discrete Self-Similar Solutions of Einstein-Klein-Gordon at Large D” by Christian Ecker, Florian Ecker and Daniel Grumiller, 12 May 2026,
Physical Review Letters
DOI: 10.1103/qgl5-5l3t
Never miss a breakthrough:
Join the SciTechDaily newsletter.
Follow us on
Astrophysics
Vienna University of Technology
Physicists Unlock a New Way To Detect Tiny Fluctuations in Spacetime
The Universe’s Engine Is Changing: DESI Hints Dark Energy Isn’t What We Thought
Guardians of the Universe: How Quantum Black Holes Hide the End of Space and Time
The Hunt for Dark Matter: Astronomers Uncover Unexpected Findings in the Lyman-Alpha Forest
These Unusual Black Holes Offer an Infinite Number of Possible Futures
Hands-On Tests at Sandia’s Z Machine Contradict Black Hole Models
Study Takes Singularity Out of Black Holes
Black Holes Have Properties That Resemble the Dynamics of Solids and Liquids
Ultracold Neutrons Could Escape to Another Braneworld",https://scitechdaily.com/the-strange-spacetime-crystal-that-can-suddenly-turn-into-a-black-hole/,scitechdaily,综合科技,无,2026-06-12T21:09:49+00:00
A Hidden Gut Signal May Be Driving Sleep Apnea’s Deadly Heart Risks,2026-06-12,"Scientists discovered a surprising gut-heart connection that may help prevent sleep apnea from causing serious cardiovascular damage.
Sleep apnea affects millions of people worldwide and is known to raise the risk of serious cardiovascular problems. Now, researchers have identified a potential new treatment target that could help reduce some of the condition’s harmful effects. Findings presented at ASM Microbe 2026 suggest that gut microbes and the way they alter bile acids may play an important role in protecting against sleep apnea-related heart and metabolic damage.
Obstructive sleep apnea is a common disorder in which breathing repeatedly stops and starts during sleep. These interruptions reduce oxygen levels while allowing carbon dioxide to build up, triggering a range of biological changes throughout the body.
Previous studies have shown that low oxygen levels can alter bile acids, compounds produced by the liver, stored in the gallbladder, and released into the intestines to help digest fats. Beyond their digestive role, bile acids also act as signaling molecules that interact with receptors throughout the body.
Researchers had previously demonstrated that gut microbes can modify bile acids, influencing the development of atherosclerosis, the buildup of fatty plaques inside arteries. Because bile acids enter the bloodstream, they can affect tissues and organs far beyond the digestive system.
“We were pretty sure from our previous studies that bile acids, especially microbially modified ones, were a key to regulating the disease so we wanted to know what happens when one of the key receptors for them are missing — does the disease go away?” said study first author Celeste Allaband, DVM, Ph.D. from the University of California, San Diego.
To explore that question, the team studied two groups of mice. One group consisted of mice genetically prone to heart disease, known as ApoE knock-outs. The second group included mice that were also prone to heart disease but lacked a bile
receptor called the farnesoid X receptor (FXR). These animals are known as ApoE/FXR knock-outs.
Both groups were exposed either to normal sleeping conditions with room air or to conditions designed to mimic sleep apnea. Throughout the study, researchers analyzed gut microbes and metabolites using fecal samples. At the end of the experiment, they measured the amount of fatty plaque that had accumulated in the animals’ arteries.
“Our study shows that the FXR host receptor, which can be activated or deactivated by bile acids, plays a central role in driving the buildup of fatty plaques in the arteries during sleep apnea-like conditions,” Allaband said. “Strikingly, when this receptor was removed from the mice, the development of arterial plaques dropped significantly in some areas and disruptions to the gut microbiome were minimized.”
The results revealed that mice lacking the FXR receptor developed significantly less plaque in both the aorta and the aortic arch. Some plaque formation still occurred in the pulmonary artery, but the overall burden was reduced. The researchers also observed that sleep apnea-like conditions had a smaller impact on the gut microbiome and the collection of metabolic compounds produced within the body.
“These results tell us that microbially modified bile acids and how they signal through the receptor we knocked out (FXR) seem to be key to the impact of sleep apnea-like conditions in our mouse model. We also identified specific bile acids of interest to explore further,” Allaband said.
The research team is now pursuing several follow-up studies. One goal is to examine human datasets to determine whether the same biological patterns seen in mice are present in people with sleep apnea.
“We also plan to take some of our key bile acids of interest and see if supplementation of these compounds alone can help prevent or reduce disease,” Allaband said. “We may also take some key microbes of interest and see if they can be given preventively as a probiotic. There is lots of exciting future work to come.”
If similar effects are confirmed in humans, future therapies could potentially target bile acids, the FXR receptor, or beneficial gut microbes to help prevent or reduce the cardiovascular complications associated with sleep apnea.
Meeting: ASM Microbe 2026
Never miss a breakthrough:
Join the SciTechDaily newsletter.
Follow us on
American Society for Microbiology
New Study Links Specific Gut Bacteria to Common Heart Disease
Obstructive Sleep Apnea Is Common in Kids – May Impact Blood Pressure and Heart Health
Sleep Apnea Worsens Heart Disease – Yet It Often Goes Untreated
Urgent Action in Children Required to Tackle Cardiovascular Deaths
Beating Heart Patch Repairs Damage Caused by Heart Attack
Smartphones Can Disrupt Pacemakers and Cause Painful Shocks
Research Shows There Is a Medical Benefit to Reducing D2B Time
UCLA Cardiologists Complete Their First Transcatheter Aortic Valve Replacement
Survival Rates for Mitral Valve Surgery Patients Improve",https://scitechdaily.com/a-hidden-gut-signal-may-be-driving-sleep-apneas-deadly-heart-risks/,scitechdaily,综合科技,无,2026-06-12T21:09:50+00:00
严纯华院士领衔！北京大学周欢萍团队：钙钛矿纳米晶薄膜 | Nature,2026-06-12,"近日，严纯华院士领衔的北京大学周欢萍团队在钙钛矿发光二极管领域取得重要突破。针对蓝光器件长期存在的“高结晶度”与“小尺寸”难以兼得的技术瓶颈，团队开发出“原位纳米晶限域”策略，实现了钙钛矿纳米晶的尺寸约束与高度结晶的协同优化。基于该方法制备的天蓝光钙钛矿LED外量子效率达6.5%，工作寿命提升两个数量级，为高性能蓝光及叠层白光器件开辟了新路径。相关成果发表于
金属卤化物钙钛矿因其优异的发光特性，已成为下一代发光二极管（LED）的有力候选材料。尽管绿光和红光钙钛矿LED（PeLED）的外量子效率（EQE）已超过30%，但蓝光PeLED的性能仍显著落后，主要瓶颈在于通过原位合成法在基底上制备钙钛矿纳米晶时，同时实现“高结晶度”与“小尺寸”存在固有矛盾。高结晶度有助于抑制非辐射复合，而纳米级晶粒则能通过载流子限域效应提升辐射效率。然而，传统溶剂工程、退火及添加剂策略虽能改善结晶性，却往往导致微米级晶粒；而原位生长的纳米晶又常面临单分散性差、表面缺陷多和结晶度低的问题。因此，开发一种能同时精确控制钙钛矿纳米晶结晶度与尺寸限制的简便、可控且普适的方法，对于推动蓝光PeLED发展至关重要。
针对以上难题，北京大学周欢萍、严纯华院士以及孙聆东等研究者在Nature上发表了题为“In situ nanocrystal confinement for efficient blue perovskite LEDs”的论文，报道了一种通过原位聚合驱动纳米晶限域策略，高效合成高质量蓝光钙钛矿纳米晶薄膜的方法。该策略利用原位形成的聚合物网络在晶体生长过程中施加纳米尺度的空间限制，成功制备出尺寸小、光致发光量子产率（PLQY）高达83%的钙钛矿纳米晶。同时，具有充足配位点的可聚合单体能够延长钙钛矿团簇的晶格重排时间，从而提升纳米晶的结晶度。利用这些纳米晶制备的蓝光PeLED在491 nm处实现了21.8%的外量子效率（EQE），这是目前蓝光PeLED的最高性能之一。该工作实现了对钙钛矿结晶热力学与有机配体反应的协同调控，深化了对配体工程影响纳米晶合成机制的理解，为发展高效PeLED及其他光电器件提供了新思路。
图1、原位纳米晶限域策略的示意图及核心机制© 2026 Nature
图2 钙钛矿结晶动力学分析© 2026 Nature
图3、钙钛矿纳米晶体的发光特性© 2026 Nature
图4、PeLED器件的性能和稳定性© 2026 Nature
综上所述，该项研究提出的原位聚合限域策略，通过聚合物网络在结晶过程中的动态空间限制与多齿配位协同作用，成功解决了钙钛矿纳米晶“高结晶度”与“小尺寸”难以兼得的难题。该策略不仅能将晶粒尺寸降至约11 nm并诱导室温立方相，显著抑制电子-声子耦合导致的非辐射损失，还具有良好的普适性，可扩展至其他钙钛矿体系及胶体纳米晶合成。基于此优化的蓝光PeLED实现了21.8%的创纪录EQE和显著提升的工作稳定性。这项工作不仅为高性能蓝色PeLED提供了可行方案，也推动了配体工程在钙钛矿纳米晶合成领域的理论认知。",https://news.solarbe.com/202606/12/50024328.html,索比光伏,光伏,无,2026-06-12T21:10:17+00:00
宇电温控器被“十四五”规划高等学校教材收录，为唯一入选品牌,2026-06-12,"近日，宇电温控科技产品正式入选石油和化工行业“十四五”规划教材《工业控制装备原理及应用》，并完整收录于“过程控制仪表”章节。宇电成为行业唯一一个入选该教材的数字控制器品牌，产品适用于对温度、压力、液位、流量等各种工业过程参数的测量、显示和精确控制，这不仅是对宇电技术实力与行业影响力的高度认可，也意味着国产控制器获得国家级权威教材认可，成为自动化专业人才培养的典型案例。
《工业控制装备原理及应用》是高等学校自动化类专业系列教材，由中国化工教育协会主办、化学工业出版社出版，是国内极具权威性的规划教材。在“过程控制仪表”章节中，教材以AI-8系列数字控制器为教学范例，从设备选型、面板功能、接线方法到实际应用场景，进行了系统详尽的解析。
该教材在文中明确表示，“宇电先进技术方面实现了对进口仪表的赶超。在数字控制器国产化替代方面成功获得突破，技术指标全面领先进口同类产品，真正体现了大国工匠精神。”此次入选教材既帮助学生掌握国产高精度控制器原理，为行业输送熟悉国产设备的工程师，也推动了国产仪表在产学研各环节的普及应用。
未来，宇电将持续推进技术创新，积极参与行业标准制定与教学实践，推动更多自主产品走进高校课堂，携手各界共建产教协同与人才培养生态，助力制造强国与人才强国。
宇电AI-888数字控制器
宇电AI-888数字控制器凭借卓越的性能，被清华大学、中国科学院等权威专家评定为“国际先进水平”，该产品已在半导体、光伏、锂电池等多个高端制造领域广泛应用。
测量精度达0.1级，能满足不同行业的温度、压力、液位、流量等精密控制需求。
搭载新型APID自整定自适应控制算法，在大滞后、额外扰动等复杂工况下仍能实现无超调、无欠调的精确控制。
具有串级控制、AAT 先进快速自整定、50 段程序控制、加热冷却双输出、手自动无扰切换、外部事件输入、输入多点修正等丰富功 能，适配各类复杂工艺场景。
支持宇电AIbus及通用Modbus通讯协议，并可通过通信控制器灵活转换为TCP、EtherCAT等通讯方式，与智能制造系统无缝对接。
关于厦门宇电自动化科技有限公司
厦门宇电自动化科技有限公司成立于1991年，是国家级专精特新重点“小巨人”企业，国家级高新技术企业，国内温控仪表与工业自动化测控领域龙头企业，工业温控器国家标准主草单位。目前在温控器细分领域的产业规模居全球前列，产品覆盖半导体、光伏、锂电池、生物医药和高端材料等数百个行业。
宇电产品以低温漂、高抗干扰、长寿命和低失效率著称。自研高端温控器聚焦高性能及高可靠性，被国内半导体设备头部企业作为替代进口产品的优先选择，已成功批量用于对可靠性要求极为严苛的半导体前道核心设备。通用多功能系列温控器在高可靠性的同时具有高性价比，在光伏核心设备市场占有率超过70%，也是唯一被全部锂电龙头企业均纳入选型目录的国产温控器，目前锂电行业超过半数的智能温控器均选择宇电品牌。宇电温控器还成功应用于热处理、高端材料、机械设备、生物医药、环保、化工等数十个国民经济产业及航空航天领域。
作为中国仪器仪表行业协会显示控制仪表理事长单位，宇电主持和参与50余项国家/行业标准制定，通过CE、UL、TÜV、RoHS、ISO14001等多项权威认证，产品销往全球150多个国家和地区，公司以“可靠、精准、节能”为核心，持续技术创新，致力成为节能环保测控技术领航者，为智能制造与工业升级提供稳定高效的自动化解决方案。",https://news.solarbe.com/202606/12/50024331.html,索比光伏,光伏,无,2026-06-12T21:10:19+00:00
广东400万辆新能源车，光储充停车场为什么是现在投资最好的时机——四条收益路径+两类场景完整测算,2026-06-12,"很多人投充电桩，投完发现「没想象中赚钱」——服务费比预期低，竞争对手多，回本周期一拖再拖。问题往往不是充电桩这个生意不行，而是只装了充电桩，少了两个关键配套。
光伏，把你的购电成本降下来。储能，让你在电价最便宜的时候充电、最贵的时候放电。三个东西合在一起，收益路径从一条变成四条，回本周期从8年压缩到2~3年。
广东是做这件事最合算的地方：400万辆以上新能源车(2025年底，全国最多)、珠三角五市目录电价峰谷差高达1.1577元/kWh(全国第一，CNESA 2026年1月)、储能系统价格刚创历史低位(0.973元/Wh，2026年4月最新中标价)——充电需求旺、峰谷差大、设备便宜，三个条件同时具备。
索比光伏网对广东两类典型场景做了完整测算：
场景一：小型园区/商业停车场(5台60kW快充桩+50kW光伏+100kWh储能)
* 年净收益(成熟期)：约15.3万元
* 回收期：约2.5年 / IRR约20%~25%
场景二：物流园重卡停车坪(8台120kW大功率桩+150kW光伏+400kWh储能)
* 总投资：约126万元
* 年净收益(成熟期)：约46.9万元
* 回收期：约2.7年 / IRR约18%~22%
两个场景的收益来自四条路径：充电服务费(主力，占收益60%~70%)、光伏自发自用降低购电成本(15%~20%)、储能峰谷套利(10%~15%)、V2G调峰响应(5%~10%，进阶选配)。缺少任意一条，年净收益都会下降5~10万元。
这篇报告还拆解了四个决定成败的关键因素：选址对充电量影响超过3倍、光伏车棚vs屋顶的选择逻辑、充电桩功率配比要求，以及三个最容易踩的坑(第一年收益预测错误/没有EMS统一管控/变压器容量没算清楚)。
以下为报告节选，完整版扫码获取",https://news.solarbe.com/202606/12/50024329.html,索比光伏,光伏,无,2026-06-12T21:10:37+00:00
Meta Bought Rivos to Accelerate Its AI Chip Push. It Isn’t Working.,2026-06-12,Subscribe to unlock,https://www.theinformation.com/articles/meta-bought-rivos-accelerate-ai-chip-push-working,the information,综合科技,科技金融,2026-06-12T21:12:44+00:00
Nvidia Pitches Vera CPU to Chinese Customers,2026-06-12,"Nvidia Pitches Vera CPU to Chinese Customers — The Information
Read this briefing for free",https://www.theinformation.com/briefings/nvidia-pitches-vera-cpu-chinese-customers,the information,综合科技,科技金融,2026-06-12T21:12:46+00:00
Customers Fret as Anthropic Launches Apps That Compete with Theirs,2026-06-12,"Customers Fret as Anthropic Launches Apps That Compete with Theirs — The Information
Read this briefing for free",https://www.theinformation.com/briefings/customers-say-anthropic-plays-favorites,the information,综合科技,科技金融,2026-06-12T21:12:48+00:00
Microsoft’s Gaming Glitch,2026-06-12,Subscribe to unlock,https://www.theinformation.com/newsletters/the-briefing/microsofts-gaming-glitch,the information,综合科技,科技金融,2026-06-12T21:12:51+00:00
"Sierra Space, Axiom Plot IPOs as SpaceX Feeds Frenzy",2026-06-12,Subscribe to unlock,https://www.theinformation.com/newsletters/dealmaker/sierra-space-axiom-plot-ipos-spacex-feeds-frenzy,the information,综合科技,科技金融,2026-06-12T21:12:53+00:00
Anthropic Blindsides Its Business Partners,2026-06-12,Subscribe to unlock,https://www.theinformation.com/articles/anthropic-blindsides-business-partners,the information,综合科技,科技金融,2026-06-12T21:12:55+00:00
Crypto Traders Bet on SpaceX IPO Popping 20%,2026-06-12,"Crypto Traders Bet on SpaceX IPO Popping 20% — The Information
Read this briefing for free",https://www.theinformation.com/briefings/crypto-traders-bet-spacex-ipo-popping-20,the information,综合科技,科技金融,2026-06-12T21:12:57+00:00
"SpaceX Prices IPO at $135 Per Share, Starts Trading Friday",2026-06-12,"SpaceX Prices IPO at $135 Per Share, Starts Trading Friday — The Information
Read this briefing for free",https://www.theinformation.com/briefings/spacex-prices-ipo-135-per-share-starts-trading-friday,the information,综合科技,科技金融,2026-06-12T21:12:59+00:00
Snowflake Mounts Full-Court Press to Get Employees Using AI,2026-06-12,Subscribe to unlock,https://www.theinformation.com/newsletters/applied-ai/snowflake-mounts-full-court-press-get-employees-using-ai,the information,综合科技,科技金融,2026-06-12T21:13:01+00:00
"KKR, Nvidia, Others Launch $10 Billion Data Center Company",2026-06-12,"KKR, Nvidia, Others Launch $10 Billion Data Center Company — The Information
Read this briefing for free",https://www.theinformation.com/briefings/kkr-nvidia-others-launch-10-billion-data-center-company,the information,综合科技,科技金融,2026-06-12T21:13:03+00:00
"Anthropic Pursues First Data Center Leases, Seeks Financial Backing From Google",2026-06-12,Subscribe to unlock,https://www.theinformation.com/articles/anthropic-pursues-first-data-center-leases-seeks-financial-backing-google,the information,综合科技,科技金融,2026-06-12T21:13:05+00:00
