title,published_at,content,url,source_name,domain,sub_domain,crawled_at
Unmanned US Navy ship to launch hypersonic missile in 2027 test,2026-06-12,"Saronic and Castelion, two defense technology companies, have announced plans to combine an autonomous warship with a hypersonic strike weapon. They said this is the first attempt to put a hypersonic vehicle on an unmanned surface vessel.
Castelion’s Blackbeard hypersonic system will be launched from Saronic’s Marauder medium unmanned surface vessel, with a demonstration at sea planned for 2027.
According to the agreement, Saronic’s Marauder unmanned vessel will launch Castelion’s Blackbeard hypersonic vehicle. The companies said this is an important step toward creating strike systems that work without crews on board.
“Launching a Castelion hypersonic from a Marauder MUSV significantly changes the approach for any adversary calculating where and how the U.S. can strike,” Dino Mavrookas, co-founder and CEO of Saronic,
in a statement. “Deterrence is ultimately a function of capability, capacity, and credibility. Saronic and Castelion are working to increase all three by combining autonomous maritime and hypersonic strike capabilities that are more scalable, more affordable, and faster to field.”
The idea is to equip autonomous ships with advanced weapons that can operate across large areas of the ocean. These ships could offer more launch points for weapons and help keep people out of danger.
Castelion is also increasing production of the Blackbeard system and plans to make several thousand missiles each year. Last October, the company said Blackbeard had won several awards to help it work with both Army and Navy platforms.
“Blackbeard and Marauder will give our warfighters more shots, from more places, with fewer constraints,” Bryon Hargis, co-founder and CEO of Castelion, said in a statement.
This partnership comes as defense leaders look for ways to use more precision strike systems without raising costs. Autonomous ships capable of carrying advanced weapons are becoming an important part of this plan.
The announcement arrives during a busy period for Saronic. The company is currently expanding a shipyard in Louisiana, a project expected to be completed by the end of this year. Once finished, the facility will have the capacity to produce up to 20 Marauder vessels annually.
Late in May, Saronic
that the 180-foot-long Marauder had entered on-water trials. The vessel is designed to carry payloads weighing up to 150 metric tons, giving it the capacity to support a range of military missions.
The U.S. Navy is also evaluating the platform. Last month, the service confirmed that Saronic was among seven companies selected for its MUSV marketplace initiative. Participants will conduct at-sea testing this summer, and those who successfully complete the evaluation phase by October will receive $15 million and become eligible for future production contracts.
Beyond Marauder, Saronic has developed several autonomous surface vessels, including the Corsair. According to the company, the
can transport payloads of up to 1,000 pounds over distances exceeding 1,000 nautical miles.
The Navy’s Task Force 59, which focuses on unmanned maritime operations in Bahrain, began fielding Corsair vessels in March. The platform recently played a role in a real-world rescue mission.
On Monday, U.S. Central Command said Navy units, including Task Force 59, assisted in
two crew members from a US Army AH-64 Apache helicopter that went down near the coast of Oman.
Get the latest in engineering, tech, space & science - delivered daily to your inbox.
A versatile writer, Sujita has worked with Mashable Middle East and News Daily 24. When she isn't writing, you can find her glued to the latest web series and movies.
Robot hand uses touch and vision to harvest ripe fruit with near-100% accuracy
US safety design approval advances next-gen Aurora nuclear reactor initiative in Idaho
Dodge Charger maker road-tests solid-state EV battery hitting 90% charge in 18 minutes
Project to restore US uranium enrichment for defense programs commences operations
China’s robotic snakes slither across power lines to spot faults before failure
More from Military
US Navy drone ship gets its own production line to speed up fleet deliveries
Autonomous aircraft drops 200-pound payload within 50 feet for frontline logistics
Trump cancels planned Iran strikes, says peace agreement could come soon
US Navy’s new 20,000-ton Columbia-class nuclear-powered submarine takes shape
US Army to deploy VAMPIRE drone hunter with proven 350,000 hours of battlefield use
US Navy drone ship gets its own production line to speed up fleet deliveries
Autonomous aircraft drops 200-pound payload within 50 feet for frontline logistics
Trump cancels planned Iran strikes, says peace agreement could come soon
US Navy’s new 20,000-ton Columbia-class nuclear-powered submarine takes shape
US Army to deploy VAMPIRE drone hunter with proven 350,000 hours of battlefield use",https://interestingengineering.com/military/us-drone-ship-to-fire-hypersonic-missiles,interesting engineering,综合科技,无,2026-06-12T21:09:20+00:00
Nuclear-powered large vehicle carrier ship gets design approval,2026-06-12,"A new study has supported the concept of physically and operationally integrating a molten salt reactor (MSR) into a large vehicle carrier ship. Lloyd’s Register (LR) is working with Hyundai Heavy Industries, Korea Shipbuilding and Offshore Engineering (KSOE), and others to explore an advanced small modular reactor (SMR) installation on a pure car and truck carrier (PCTC).
The latest work examined the internal arrangement and segregation of the reactor system, shielding requirements, and the impact on cargo deck layout and vehicle capacity, alongside stability and trim implications linked to the reactor’s weight and positioning.
“While nuclear propulsion is still at an early stage of development, this project shows the importance of building technical understanding now to support future progress,”
Sung-Gu Park, President – North East Asia, Lloyd’s Register.
“Establishing feasibility at concept stage is a valuable step forward, particularly in areas such as cargo optimization, vessel stability and integrated safety design.”
The partners also assessed propulsion system configuration and power delivery, as well as operational flexibility compared with conventionally fueled PCTCs, where trade routes and port calls can be tightly constrained.
“With global environmental regulations becoming increasingly stringent and no definitive net-zero fuel yet available, SMR-powered ships can serve as a highly effective alternative, representing a pioneering next-generation maritime technology capable of complying with GHG emission regulations while allowing lifetime operation without refueling, and HD HHI will remain at the forefront of sustainable maritime technology development,” said Hong-Ryeul Ryu, CTO and Senior Executive Vice President at HD HHI.
It’s also revealed that a key focus of the project has been safety. LR led hazard identification (HAZID) and preliminary risk assessment work, focusing on containment, onboard safety systems and potential operability constraints tied to nuclear technology at
Korea Atomic Energy Research Institute (KAERI) also considers the latest study a meaningful achievement in assessing the potential application of SMRs in the maritime sector, taking actual ship operating environments into account. The study is particularly significant because it examined the technical feasibility of applying an MSR type marine SMR to a specific target vessel, namely a PCTC,
according to
Get the latest in engineering, tech, space & science - delivered daily to your inbox.
Prabhat, an alumnus of the Indian Institute of Mass Communication, is a tech and defense journalist. While he enjoys writing on modern weapons and emerging tech, he has also reported on global politics and business. He has been previously associated with well-known media houses, including the International Business Times (Singapore Edition) and ANI.
Robot hand uses touch and vision to harvest ripe fruit with near-100% accuracy
US safety design approval advances next-gen Aurora nuclear reactor initiative in Idaho
Dodge Charger maker road-tests solid-state EV battery hitting 90% charge in 18 minutes
Project to restore US uranium enrichment for defense programs commences operations
China’s robotic snakes slither across power lines to spot faults before failure
More from Transportation
Transportation
New plane prototype conducts maiden piloted flight, can transform hybrid-electric aircraft future
Transportation
KLM operates first passenger flight to Germany with synthetic kerosene-blended fuel
Transportation
World’s first electric TaxiBot tows Airbus A320 jets at 26 mph in the Netherlands
Transportation
World’s largest dam to get giant water staircase to let 11,000-ton ships pass faster
Transportation
Video: X-59 goes supersonic with 713 mph flight, paves way for quiet high-speeding jets
Transportation
New plane prototype conducts maiden piloted flight, can transform hybrid-electric aircraft future
Transportation
KLM operates first passenger flight to Germany with synthetic kerosene-blended fuel
Transportation
World’s first electric TaxiBot tows Airbus A320 jets at 26 mph in the Netherlands
Transportation
World’s largest dam to get giant water staircase to let 11,000-ton ships pass faster
Transportation
Video: X-59 goes supersonic with 713 mph flight, paves way for quiet high-speeding jets",https://interestingengineering.com/transportation/ship-integrated-nuclear-propulsion-design-approval,interesting engineering,综合科技,无,2026-06-12T21:09:22+00:00
HII forms a dedicated scalable production line for Romulus USV,2026-06-12,"Bayou Metals, a manufacturing partner of defense shipbuilder Huntington Ingalls Industries (HII), has stood up a dedicated production line for the Romulus uncrewed surface vessel (USV), a move intended to compress delivery timelines and increase throughput for the US Navy’s growing unmanned maritime program.
The production line is located in Slidell, Louisiana. Bayou Metals is also serving as a strategic marine-grade aluminum supplier to the HII.
Rather than routing Romulus components through a generalized fabrication workflow, Bayou Metals configured a dedicated manufacturing line specifically for the vessel’s metalwork and structural assemblies. This single-product-line architecture reduces setup changeover time and allows process engineers to optimize fixturing, weld sequencing, and quality inspection around a single repeating geometry—a standard lean-manufacturing approach when volume and schedule pressure justify the capital allocation.
The Romulus family of
is designed for a wide range of mission sets, including intelligence, surveillance, and reconnaissance (ISR), mine countermeasures, strike operations, and counter-unmanned systems. It can also serve as a
to launch and recover unmanned
vehicles (UUVs) and unmanned aerial vehicles (UAVs). It is centered on HII’s Odyssey autonomy software suite and open systems architecture.
HII has been developing the platform as part of the broader US Navy push to field autonomous and semi-autonomous surface vessels capable of operating alongside crewed combatants. Romulus is being developed in partnership with Breaux Brothers, Shield AI, Beier Integrated Systems, and Incat Crowther.
The Bayou Metals arrangement illustrates how prime defense contractors are structuring supply chains for unmanned platforms differently from traditional crewed ships. Because USVs are expected to be procured in larger numbers at lower per-unit cost than destroyers or frigates, the production economics demand a more industrialized approach from tier-one and tier-two suppliers early in the program lifecycle — before the Navy has necessarily committed to a high-rate production contract.
HII has been expanding its unmanned and autonomous systems work through its Mission Technologies division, positioning itself beyond traditional nuclear shipbuilding. The Romulus program sits within that strategic push.
Production readiness reviews assess not just the prime contractor’s internal capacity but the depth and reliability of the supplier base. A named, dedicated manufacturing line at a partner facility is a tangible data point in that evaluation criteria.
In addition to the vessel currently under construction, four additional Romulus 151 vessels will be built by
Breaux Brothers Enterprises
in Louisiana. This effort for HII also supports the expansion of the U.S. shipbuilding industrial base by growing Gulf Coast manufacturing capacity.
Get the latest in engineering, tech, space & science - delivered daily to your inbox.
Robot hand uses touch and vision to harvest ripe fruit with near-100% accuracy
US safety design approval advances next-gen Aurora nuclear reactor initiative in Idaho
Dodge Charger maker road-tests solid-state EV battery hitting 90% charge in 18 minutes
Project to restore US uranium enrichment for defense programs commences operations
China’s robotic snakes slither across power lines to spot faults before failure
More from Military
US’ new 180-foot drone ship could launch hypersonic missiles, demo set for 2027
Autonomous aircraft drops 200-pound payload within 50 feet for frontline logistics
Trump cancels planned Iran strikes, says peace agreement could come soon
US Navy’s new 20,000-ton Columbia-class nuclear-powered submarine takes shape
US Army to deploy VAMPIRE drone hunter with proven 350,000 hours of battlefield use
US’ new 180-foot drone ship could launch hypersonic missiles, demo set for 2027
Autonomous aircraft drops 200-pound payload within 50 feet for frontline logistics
Trump cancels planned Iran strikes, says peace agreement could come soon
US Navy’s new 20,000-ton Columbia-class nuclear-powered submarine takes shape
US Army to deploy VAMPIRE drone hunter with proven 350,000 hours of battlefield use",https://interestingengineering.com/military/hii-forms-production-line-for-romulus-usvs,interesting engineering,综合科技,无,2026-06-12T21:09:25+00:00
Mini Brain Organoids Expose Hidden Biological Differences in Alzheimer’s Disease,2026-06-12,"Tiny lab-grown brain models and the particles they release may reveal hidden differences among
Personalized treatment remains one of the biggest challenges in Alzheimer’s disease. Two patients can receive the same medication for symptoms such as depression, anxiety, or agitation and experience very different outcomes, leaving doctors with few ways to predict who will benefit.
Now, researchers at
Johns Hopkins Medicine
have developed miniature brain models grown from patients’ own cells that may help explain those differences. The study suggests these lab-grown tissues can capture key biological features of Alzheimer’s disease and reveal how individual patients might respond to commonly prescribed medications.
The researchers also identified promising clues inside tiny particles released by the organoids. These particles, known as extracellular vesicles, carry molecular information that could eventually help scientists diagnose Alzheimer’s disease, track its progression, and distinguish between different forms of the disorder.
The findings were published in
Alzheimer’s & Dementia: The Journal of the Alzheimer’s Association
Alzheimer’s disease affects more than 7 million Americans and remains the most common cause of dementia. Although recent advances have produced treatments that target disease-related proteins in the brain, many patients still depend on medications designed to manage behavioral and psychological symptoms that often accompany the condition.
Those treatments do not work equally well for everyone.
“Our study suggests that large-scale, patient-derived brain organoids and the vesicles they secrete can help us stage Alzheimer’s disease, investigate the mechanisms that drive it and assess how patient subgroups may respond to different treatments,” says study leader Vasiliki Machairaki, Ph.D., associate professor of genetic medicine at the Johns Hopkins University School of Medicine.
To investigate why patients respond differently, the team turned to brain organoids, small clusters of living brain tissue grown in the laboratory. Unlike conventional cell cultures, organoids can mimic some of the cellular organization and interactions found in the human brain, providing researchers with a more realistic model for studying disease.
The scientists began with blood samples collected from patients enrolled in the NIH-funded Johns Hopkins Alzheimer’s Disease Research Center. Those cells were reprogrammed into induced pluripotent stem cells, which can develop into nearly any cell type in the body.
Using stem cells from both Alzheimer’s patients and healthy volunteers, the researchers produced hindbrain organoids containing serotonin-producing neurons. The hindbrain plays an important role in regulating functions such as sleep, breathing, and heart rate, while
signaling has long been linked to mood and behavior.
The cells organized themselves into pea-sized structures that resembled aspects of the human hindbrain. According to Machairaki, the study may be among the largest Alzheimer’s investigations to use patient-derived brain organoids, involving hundreds of organoids from both patients and healthy individuals.
When the researchers compared organoids from Alzheimer’s patients with those from healthy individuals, they found clear molecular differences. Proteins involved in cell communication, inflammation, and other disease-related processes were altered in the Alzheimer’s-derived tissues.
The team then exposed the organoids to escitalopram oxalate, a commonly prescribed antidepressant in the selective serotonin reuptake inhibitor (SSRI) class.
Some organoids responded strongly, showing increases in proteins associated with serotonin signaling and communication between neurons. Others showed little or no measurable change.
That variation closely mirrors what doctors observe in real patients, where responses to the same medication can differ dramatically despite similar diagnoses.
“We used these organoids to model how some patients’ tissue may respond to a commonly prescribed SSRI,” Machairaki says. “On a large-scale level, our model may eventually be used to identify subgroups of patients, based on underlying molecular mechanisms, who are more likely to respond to certain drugs and thus help us to create precise, targeted treatments in the long run.”
The researchers also examined extracellular vesicles, microscopic particles released by cells that transport proteins and other biological material throughout the body.
Because these particles can be detected in bodily fluids such as blood, scientists are increasingly studying them as potential sources of disease biomarkers that could be measured without invasive procedures.
Before and after escitalopram treatment, the team analyzed extracellular vesicles released by both Alzheimer’s-derived organoids and healthy controls.
The vesicles contained proteins involved in memory,
neurotransmitter
release, and communication between neurons. Several proteins linked to Alzheimer’s disease, including RAB3A, NSF, and ATCAY, appeared at lower levels in organoids derived from patients with the disease.
After treatment, some of those proteins increased in certain samples, particularly proteins associated with serotonin signaling and synaptic activity.
As with the organoids themselves, responses varied considerably between samples. Some showed substantial molecular changes, while others showed almost none.
The findings suggest that extracellular vesicles could eventually help identify which patients are most likely to benefit from specific therapies, potentially allowing treatments to be matched more closely to the biology of an individual’s disease.
The researchers are now working to create more advanced organoids that include immune cells and vessel-like networks that mimic blood vessels. These additions could make the models more representative of the living human brain and improve their value for studying Alzheimer’s disease.
Looking ahead, Machairaki envisions a future in which extracellular vesicles serve as a type of liquid biopsy, helping doctors diagnose Alzheimer’s disease, determine its stage, and identify distinct biological subtypes that may require different treatment approaches.
Reference: “Proteomic profiling of brain organoids and extracellular vesicles identifies early Alzheimer’s disease biomarkers and drug response heterogeneity” by Rachel J. Boyd, Daiyun Dong, Ram Sagar, Anton Iliuk, Waqar Ahmed, Xenia Androni, Anton P. Porsteinsson, Paul B. Rosenberg, Constantine G. Lyketsos, Kenneth W. Witwer and Vasiliki Mahairaki, 8 April 2026,
Alzheimer’s & Dementia
DOI: 10.1002/alz.71273
In addition to Machairaki, scientists who contributed to this work include Rachel Boyd, Daiyun Dong, Ram Sagar, Waqar Ahmed, Xenia Androni, Paul Rosenberg, Constantine Lyketsos and Kenneth Witwer from Johns Hopkins, Anton Iliuk from Tymora Analytical Operations and Anton Porsteinsson from University of Rochester School of Medicine and Dentistry.
Funding for this study was provided by the
National Institutes of Health
(T32 AG058527, R01AG052510, P30AG066507, 1RF1AG083801, AGR01054771, AGR01050515, AGR01046543 and AGR01071522), the Paul G. Allen Frontiers Foundation and the Richman Family Precision Medicine Center of Excellence in Alzheimer’s Disease at The Johns Hopkins University.
Never miss a breakthrough:
Join the SciTechDaily newsletter.
Follow us on
Alzheimer's Disease
These Signs of Memory Loss Could Actually Predict Alzheimer’s Brain Changes
Are We Evolving? New Research Reveals That Human Brains Are Getting Larger
Scientists Discover New Telltale Sign of Alzheimer’s
Certain Protein May Predict Mild Cognitive Impairment Years Before Symptoms
Losing Your Sense of Smell – A Potential Warning of Future Memory and Thinking Problems
Early Menopause May Increase Risk of Alzheimer’s Disease
Alleviating Symptoms: Brain Stimulation Could Help Treat Alzheimer’s Disease
Alzheimer’s Breakthrough: New Therapeutic Target Found
A Diabetes Drug Could Protect Against Alzheimer’s",https://scitechdaily.com/mini-brain-organoids-expose-hidden-biological-differences-in-alzheimers-disease/,scitechdaily,综合科技,无,2026-06-12T21:09:30+00:00
