title,published_at,content,url,source_name,domain,sub_domain,crawled_at
JinkoSolar launches 700 W TOPCon solar module with 25.91% efficiency - pv magazine Global,2026-06-03,"Technology & Products
Tiger Neo 5.0 uses a high-purity homogeneous silicon substrate, broad-spectrum light-trapping structure, full-area passivation and gap-free cell-array encapsulation to improve conversion efficiency and module-level output.
Vincent Shaw
Technology & Products
Utility-scale
The new product was presented at the SNEC 2026 tradeshow in Shanghai | Image: pv magazine/Vincent Shaw
Chinese PV module maker
launched its new Tiger Neo 5.0 module series at the SNEC 2026 trade show in Shanghai, China.
The company said the product represents an upgrade from its earlier 670 W Tiger Neo 3.0 module. It delivers up to 700 W of output at the same module size as the previous generation, with module efficiency of 25.91% and power density of more than 259 W/m².
The panel uses a high-purity homogeneous silicon substrate, broad-spectrum light-trapping structure, full-area passivation and gap-free cell-array encapsulation to improve conversion efficiency and module-level output.
The company is positioning the module for utility-scale ground-mounted projects, commercial and industrial bifacial applications and residential monofacial systems. In comparison to Tiger Neo 3.0, Tiger Neo 5.0 can reportedly increase power generation by 2.1% in utility-scale ground-mounted projects, 1.9% in commercial and industrial bifacial scenarios and 0.9% in residential monofacial applications.
The module has a bifaciality of over 85%, a temperature coefficient of -0.26%/C, first-year degradation of no more than 1% and annual linear degradation of 0.35%, according to the company.
JinkoSolar also said the module displayed stronger performance under partial shading in third-party testing, with lower power losses than comparable products under light and moderate shading conditions.
No further technical details about the new product were revealed.
Alongside the Tiger Neo 5.0, JinkoSolar introduced a scenario-based module portfolio covering six application categories. The portfolio includes its Dust-Resistant module, which uses a three-dimensional anti-dust design and nano-coated glass to reduce operation and maintenance costs, and its AIDC module designed for data centers, with the company claiming more than 3% higher lifecycle power generation and an 88.6% reduction in system risk costs.
The portfolio also featured the company’s Safety Guardian module designed for high-reliability applications, with resistance to 55 mm hail, dual Class A fire certification and high mechanical load capacity and its Anti-Glare module with a reflectance of 7% that targets transport hubs and other sites where light pollution is a concern.
The portfolio is rounded out by the LiteTitan module, which weighs 7 kg/m² for load-restricted rooftops, and the Mount Tai module, which features a strengthened frame for harsh environments such as deserts and wastelands.
Vincent Shaw
View author posts",https://www.pv-magazine.com/2026/06/03/jinkosolar-launches-700-w-topcon-solar-module-with-25-91-efficiency/,pv magazine,综合新能源,光伏、氢能、储能,2026-06-03T22:36:53+00:00
Vietnam’s first direct power purchase agreement enters operation - pv magazine Global,2026-06-03,"Applications & Installations
Energy analyst Lam Pham tells
direct power purchase agreements will be a significant catalyst for solar deployment in Vietnam after the first such agreement, tied to a 49 MW solar plant, begins operating.
Patrick Jowett
Applications & Installations
Asia-Pacific
Commercial & industrial
Duc Hue 2 solar power plant | Image: Samsung Electronics
’s first grid-connected direct power purchase agreement (DPPA) is now live.
The DPPA is between Samsung Electronics Vietnam Thai Nguyen (SVET) and TTC Duc Hue–Long An Power, developer of the 49 MW Duc Hue 2 solar power plant in Tây Ninh province, southern Vietnam.
Under the terms of the agreement, SVET’s smartphone factory, located in the Yen Binh Industrial Park in northern Vietnam, will receive approximately 70 GWh of solar electricity each year, equivalent to the annual power consumption of roughly 17,000 Vietnamese households.
“Through this first DPPA contract, we hope to contribute to promoting the development of Vietnam’s renewable energy market, while actively supporting global efforts to address the climate change crisis,” commented Na Ki Hong, General Director of Samsung Vietnam.
Lam Pham, Energy Analyst, Asia, at Ember told
Vietnam’s first operational DPPA marks a pivotal moment for the country’s energy transition.
“For years, multinational corporations operating in Vietnam have faced structural bottlenecks in meeting their global RE100 commitments,” he said. “The project is proof that the regulatory framework is now viable in practice and will significantly enhance Vietnam’s attractiveness to green foreign direct investment.”
The legal framework for DPPAs in Vietnam first came into effect in July 2024, Pham said, initially with rigid eligibility conditions limited to large electricity users for production purposes. He explained this was replaced with an updated decree in March 2025, relaxing these conditions and introducing more detailed guidance on both physical private DPPAs and grid-connected DPPA contracts.
Pham added that he expects DPPAs to be a significant catalyst for solar deployment in Vietnam, particularly in the commercial and industrial sector. He said there are many multinational manufacturers operating in the country carrying corporate renewable energy commitments, including 159 with 100% renewable energy targets.
“The DPPA mechanism now gives them and future investors with green commitments a direct, bankable route to fulfil the target,” Pham explained. “This will unlock massive private investment into solar development that was previously constrained by the state utility model.”
Pham also said that looking ahead, Vietnam’s revised time-of-use tariff framework, which removes the morning peak and concentrates high tariffs in the evening, is likely to reshape how DPPAs are structured.
“As midday solar generation no longer aligns with peak pricing, future deals will increasingly need to pair generation with storage or renewables that perform better in the evening such as wind power,” he told
. “This is likely to push the market toward more flexible, integrated energy sources.”
Vietnam’s solar capacity
surpassed 19 GW
Patrick Jowett
View author posts",https://www.pv-magazine.com/2026/06/03/vietnams-first-direct-power-purchase-agreement-enters-operation/,pv magazine,综合新能源,光伏、氢能、储能,2026-06-03T22:36:55+00:00
France sees negative spot price of -€498/MWh - pv magazine Global,2026-06-03,"Markets & Policy
The French electricity market has recorded nearly 450 hours of zero or negative prices since the beginning of 2026, compared with around 320 over the same period in 2025.
Gwénaëlle Deboutte
Markets & Policy
Image: Lucas Gallone/Unsplash
The French electricity market recorded a negative spot price of -€498/MWh on May 1, according to the price observatory of French startup Storio Energy.
The record low was recorded at 13:00 and was followed by -€471/MWh at 14:00. It has been attributed to low consumption linked to the public holiday, combined with reduced flexibility in the nuclear fleet, a phenomenon also observed in April.
For comparison, the lowest price recorded on May 1, 2025, was -€118/MWh.
The spread between the most expensive hour and cheapest hour in France during May reached €141/MWh, a level unprecedented during the month. Storio Energy’s analysis says the indicator did not exceed €100/MWh even at the height of the 2022 energy crisis when the average electricity price was around €200/MWh.
Since the beginning of the year, the French electricity market has recorded nearly 450 hours of zero or negative prices, compared with around 320 over the same period of 2025.
In May, 80% of the days were impacted by zero or negative prices, as well as nearly two thirds of hourly slots between 13:00 and 17:00.
Storio Energy’s analysis adds that in May, a 1 MW/2 MWh battery charged at an average of -€8/MWh and discharged at €111/MWh, completing around 1.2 cycles per day.
Since the beginning of 2026, the average spread has thus reached €119/MWh, more than double the levelized cost of storage. In this context, arbitrage revenues achievable by batteries in the spot market increased by 34% in 2026 compared with the January to May 2025 period.
Gwénaëlle Deboutte
View author posts",https://www.pv-magazine.com/2026/06/03/un-prix-spot-negatif-record-de-498-e-mwh-enregistre-le-1er-mai/,pv magazine,综合新能源,光伏、氢能、储能,2026-06-03T22:36:57+00:00
Anker Solix launches 2 kWh home backup power system - pv magazine Global,2026-06-03,"Technology & Products
The Chinese manufacturer says the new S2000, with a 400 W solar input, can deliver up to 35 hours of continuous refrigerator backup.
Technology & Products
Energy Storage
The S2000 | Image: Anker SOLIX
Chinese manufacturer
has announced a new 2 kWh home backup power station.
The company claims the product, named S2000, delivers up to 35 hours of continuous refrigerator backup. It received the highest rating from TÜV SÜD for real-world power delivery.
“Runtime is not just about how much energy is stored, but how much is actually delivered, after idle drain and conversion loss,” a statement from the company explains. “The S2000 is powered by proprietary OptiSave Technology, a system-level approach that reduces idle power consumption by 40-70%, down to sub-6W, and achieves over 90% light-load efficiency.”
The system uses 314 Ah LiFePO4 battery cells with up to 10,000 cycles. It has a 400 W solar input, while its AC input is 1,150 W, 1,800 W, and 1,600 W for charging, bypass and ultrafast charging, respectively. It has five 1,500 AC outputs, one 100 W USB-C output, one 15 W USB-C output and one 12 W USB-A output.
The uninterruptible power supply (UPS) switch-over time is listed as under 10 ms. The backup system measures 208 x 282 x 323.3 mm and weighs 16.2 kg. Its discharging temperature is between -20 C and 40 C, while its charging temperature is between 0 C and 40 C.
View author posts",https://www.pv-magazine.com/2026/06/03/anker-solix-launches-2-kwh-home-backup-power-system/,pv magazine,综合新能源,光伏、氢能、储能,2026-06-03T22:36:58+00:00
Mexico exceeds 5 GW of distributed solar capacity - pv magazine Global,2026-06-03,"Applications & Installations
Figures published by Mexico’s National Energy Commission show solar accounted for more than 99.5% of distributed generation capacity in systems smaller than 0.7 MW at the end of 2025.
Applications & Installations
Markets & Policy
Image: Julio Lopez/Unsplash
Distributed solar generation in Mexico reached an installed capacity of 5,164.98 MW across 600,368 applications by the end of 2025, according to
Total distributed generation from interconnected power plants smaller than 0.7 MW reached 5,189.71 MW across 600,651 processed applications, CNE data adds, meaning solar represents over 99.5% of the total.
The estimated investment associated with the solar systems amounts to $13.217 billion, based on a capital expenditure of $2,559/kW. The total estimated investment across all distributed generation technologies reaches $13.336 billion.
CNE’s figures, covering 2007 to 2025, show that distributed generation has maintained steady growth since the implementation of Resolution RES/142/2017, which established the legal, technical and financial framework for distributed generation.
The state of Jalisco, western Mexico, has the highest number of distributed solar facilities, at 99,949, with 747.67 MW of the total capacity. The national average installed capacity per state is 162.18 MW, while the average capacity per application stands at 8.64 kW.
Net metering remains the dominant market mechanism, with 593,607 applications and 5,113.14 MW of installed capacity. Within this framework, systems of up to 50 kW account for 98.23% of applications and contribute 3,251.46 MW, representing 63.59% of total net-metered capacity. Systems ranging from 250 kW to 500 kW, although representing only 0.40% of applications, contribute 989.02 MW, or 19.34% of net-metered capacity.
The net energy billing regime includes 6,540 applications and 73.41 MW, also dominated by installations of up to 50 kW. Meanwhile, the full energy sales regime records 504 applications and 3.43 MW.
View author posts",https://www.pv-magazine.com/2026/06/03/mexico-supera-en-2025-los-5-gw-solares-en-generacion-distribuida/,pv magazine,综合新能源,光伏、氢能、储能,2026-06-03T22:37:00+00:00
Cambodia's utility-scale solar surpasses planned targets for 2030 and 2035 - pv magazine Global,2026-06-03,"Markets & Policy
A 30 MW annual rooftop quota and a compensation tariff that overshoots estimated grid impact costs by three to four times are keeping distributed solar on the sidelines as Cambodia’s utility-scale capacity races past its own long-term planning targets.
Brian Publicover
Markets & Policy
Utility-scale
Image: Shankar S., Flickr
Nearly 1.5 GW of installed solar capacity has pushed Cambodia past its Power Development Master Plan (PDP) targets for both 2030 and 2035 ahead of schedule, with solar now supplying more than 10% of national electricity generation, according to the Institute for Energy Economics and Financial Analysis (IEEFA).
Cambodia’s PDP had projected 705 MW of solar capacity by 2025, 1 GW by 2030, and 1.3 GW by 2035. IEEFA said in a briefing note this week that the country surpassed its 2025 target a year early. Several projects due for completion in 2026 are expected to add nearly 400 MW, bringing total installed solar capacity to approximately 1.87 GW by year-end, according to Electricity Authority of Cambodia projections cited by IEEFA. The 930 MW Chheu Tom Solar Complex could push total capacity beyond 2 GW, the think tank said.
Cambodia imported approximately 1 GW of solar panels from China in 2025, according to Ember data cited by IEEFA, with monthly imports reaching a record 422 MW in March 2026. A reduction of import taxes on solar and energy storage technologies from 15% to zero, effective April 1, could reduce installation costs by as much as 30%, according to one manufacturer estimate, with IEEFA projecting a 7.4% decline in total project costs.
Rooftop solar deployment has not kept pace. IEEFA said policy restrictions rooted in grid stability concerns and the financial position of state-owned utility Electricité du Cambodge continue to constrain adoption. An
annual rooftop PV quota of 30 MW
remains in place, and a
compensation tariff
that IEEFA said exceeds estimated grid impact costs by three to four times weakens project economics for commercial and industrial users, extending payback periods by nearly two years for medium and large systems.
IEEFA warned that a planned liquefied natural gas-to-power plant scheduled for commissioning in 2027 could raise electricity tariffs and increase the carbon intensity of the power system. It recommended expanding rooftop solar access and allowing the state utility to purchase surplus electricity from rooftop installations as partial offsets.
The country has committed to a renewable energy capacity share of 70% to 80% by 2030 and has joined the Fossil Fuel Treaty Initiative. IEEFA said removing rooftop solar barriers would improve access to low-cost, lower-carbon electricity for manufacturers and other large consumers already facing some of Asia’s highest electricity tariffs.
Cambodia’s rooftop solar constraints reflect a policy tension that has persisted for years. Grid stability concerns led Electricité du Cambodge to cap
variable solar penetration
well below current utility-scale deployment levels as far back as 2022, and successive tariff reforms have yet to resolve the underlying conflict between the state utility’s financial position and the cost competitiveness demands of export manufacturers.
Brian Publicover
View author posts",https://www.pv-magazine.com/2026/06/03/cambodias-utility-scale-solar-surpasses-planned-targets-for-2030-and-2035/,pv magazine,综合新能源,光伏、氢能、储能,2026-06-03T22:37:02+00:00
"Grid expansion, batteries to ease curtailment in Brazil - pv magazine Global",2026-06-03,"Markets & Policy
Analysis by Aurora Energy Research indicates curtailment in Brazil could drop by 8 to 12 percentage points by the end of the decade, down from 21% in 2025.
Markets & Policy
Imagem: Xinyi Solar
Curtailment in Brazil could begin to ease towards the end of the decade as new transmission infrastructure comes online, according to Aurora Energy Research.
Curtailment hit 21% in Brazil in 2025 and has become one of the main challenges facing the country’s electricity system.
Aurora Energy Research has developed a nodal modeling framework focused on analyzing curtailment at the asset level. The model simulates the operation of Brazil’s electricity grid with hourly granularity, incorporating information on transmission infrastructure and electrical constraints.
According to the company’s projections, curtailment levels are expected to remain high in the short and medium term. A more significant reduction is anticipated only toward the end of the 2020s, driven by transmission network expansion, growing electricity demand, and increased deployment of battery energy storage systems.
The analysis indicates that curtailment could decline by 8 to 12 percentage points by 2030.
The outcome will depend on factors such as the pace of transmission projects, renewable plant capacity factors, growth in distributed solar generation, battery adoption, and the expansion of new electricity loads, including data centers and electrolysis projects for hydrogen production.
Rodrigo Borges, Aurora Energy Research’s Brazil Market Lead, commented that curtailment has quickly moved from being a secondary consideration to becoming one of the defining risks in Brazil’s energy market.
“With this new asset-level modeling capability, we are providing investors and lenders with the transparency they need to properly assess risk, compare assets, and make capital allocation decisions with greater confidence in an increasingly complex system,” Borges said.
Borges added that the nature of curtailment is expected to change during the 2030s, with curtailment caused by excess electricity supply becoming more prevalent and replacing transmission bottlenecks as the primary driver. Under this scenario, curtailment is likely to be distributed more evenly across generation assets.
Batteries are also expected to contribute to reducing curtailment. According to Aurora’s modeling, their effects can be observed both locally, by alleviating constraints near project connection points, and at the system level, by helping balance electricity supply and demand.
Aurora’s analysis adds that further detail can improve the assessment of risks related to curtailment, energy prices, and grid access, supporting investment decisions and project planning in the power sector.
View author posts",https://www.pv-magazine.com/2026/06/03/melhorias-na-rede-eletrica-e-entrada-de-baterias-no-medio-prazo-aliviarao-curtailment-projeta-aurora/,pv magazine,综合新能源,光伏、氢能、储能,2026-06-03T22:37:04+00:00
Natural ester fluids beat mineral oil for use in renewable energy applications - pv magazine Global,2026-06-03,"Technology & Products
Compared with mineral oil, natural ester fluid enables the design of more compact, lighter, and thermally efficient transformers, helping photovoltaic applications reduce footprint, installation complexity, and overall project CAPEX compared with conventional mineral oil solutions.
Technology & Products
In the history of fluid-immersed transformers, mineral oil has long been used due to its wide availability, closely linked to the extensive development of the petroleum industry. Today, alternative natural ester fluids like FR3
fluid – manufactured by Cargill – are well known and largely chosen for use in the renewables sector. Compared with mineral oil, FR3™ fluid offers higher thermal class capability, better preservation of the insulation system, and high overload tolerance.
The advantages of FR3
fluid potentially allow higher permissible temperature rises in both oil and windings. When combined with thermally upgraded (TU) paper, it is possible to achieve a thermal class of 140 C in accordance with both IEC and IEEE product standards. This requirement can be effectively met by using FR3
fluid, while a mineral oil alternative would be either unfeasible or not cost-effective.
For example, if a customer is evaluating achievable power density using mineral oil or natural ester, they may set a goal to remain within the following dimensions: L = 1950 mm , W = 1300 mm , H = 1950 mm. Using mineral oil, the maximum feasible power rating is 3100 kVA. By switching to natural ester, it is possible to achieve 4000 kVA within the same dimensions. This means nearly 30% higher power density. The reduction in dimensions can substantially reduce CAPEX – including lower installation, civil works, and fire protection costs – while also potentially reducing OPEX through lower maintenance requirements.
The lower weight also simplifies shipping and handling operations, reducing delivery complexity, transportation effort, and associated logistics costs.
The same approach also allows the feasibility of much larger transformers with improved environmental performance. While a sealed-type integrally filled mineral oil-immersed unit can typically reach a rated power of 6-8 MVA (depending on the design characteristics), an ester-filled unit can reach up to 12 MVA or more. FR3™ fluid is 100% biodegradable in as little as 10 days according to OPPTS 835.3100. Additionally, it is readily biodegradable in accordance with OECD 301B. In contrast, mineral oil is not biodegradable and typically requires oil-containment systems to manage potential leaks or spills.
For Westrafo, which is strongly active in the renewable energy sector, FR3
fluid is the most widely used insulating fluid, with consumption four times greater than mineral oil. Westrafo’s primary customers are involved in photovoltaic (PV) plants, battery energy storage systems (BESS), and wind power installations. In many cases, these customers request transformers with a reduced footprint in order to increase power density and reduce the total CAPEX of the installation. Westrafo says FR3™ fluid’s advantages clearly demonstrate its superiority over conventional mineral oil solutions.
View author posts",https://www.pv-magazine.com/2026/06/03/natural-ester-fluids-beat-mineral-oil-for-use-in-renewable-energy-applications/,pv magazine,综合新能源,光伏、氢能、储能,2026-06-03T22:37:05+00:00
"France, Germany, Portugal, Spain set daily solar records - pv magazine Global",2026-06-03,"Markets & Policy
Latest analysis from AleaSoft Energy Forecasting finds the weekly average electricity price increased in France, Portugal and Spain last week despite new daily solar records as wind energy production fell and demand increased.
Patrick Jowett
Markets & Policy
Image: Michael Förtsch on Unsplash
France, Germany, Portugal and Spain all set new records for daily solar production last week, according to the latest analysis from AleaSoft Energy Forecasting.
The Spanish consultancy found Germany generated 503 GWh of solar energy on May 28, the same day France reached 179 GWh. A day later, Spain produced 265 GWh and Portugal 32 GWh.
The milestones represent another record-breaking week for solar production in Europe after France, Germany, Italy and Portugal all set new
solar records for a day in May
the week prior. Italy broke its record for solar production in May again last week, reaching 161 GWh on May 26.
AleaSoft’s analysis of electricity prices found the weekly average electricity price decreased last week across the Belgian, British, Dutch, German and Nordic markets, which it attributes to higher solar and wind energy production, as well as lower electricity demand.
Despite their daily solar records, France, Portugal and Spain, alongside Italy, saw a week-on-week increase in their average electricity price, which AleaSoft says was caused by a drop in wind energy production and higher demand.
The average electricity price was below €95 ($110.38)/MWh in all analyzed markets except the British and Italian market, which saw averages of €121.97/MWh and €123.58/MWh. The Nordic market registered the lowest average of the week, at €48.37/MWh.
AleaSoft is expecting this week to bring an increase in the average electricity price across most markets, driven by less solar production and higher demand.
The consultancy’s analysis of TTF gas futures in the ICE market found prices reached their lowest settlement of the week on May 25, at €45.43/MWh, before reaching their highest settlement of the week, at €47.47/MWh, the day after.
“The conflict in the Middle East continued to influence the trend in TTF gas futures prices during the fourth week of May,” AleaSoft explains. “Expectations of an agreement between the United States and Iran exerted downward pressure on prices, keeping them below €50/MWh. However, low European storage levels and higher demand driven by high temperatures limited further declines.”
Patrick Jowett
View author posts",https://www.pv-magazine.com/2026/06/03/france-germany-portugal-spain-set-daily-solar-records/,pv magazine,综合新能源,光伏、氢能、储能,2026-06-03T22:37:07+00:00
